,date,country_1,country_2,country_3,country_4,countries,organization,claim,source,source_url,fact_check_url,fact_check_lang,final_rating,explanation,category,countries_list,source_domain,resolved_url,resolved_domain,datetime,claim_p
3861,4/9/20,United States,,,,United States,FactCheck.org,Bill Gates is plotting to use COVID-19 testing and a future vaccine to track people with microchips.,Facebook users,https://www.facebook.com/groups/346378325942318/permalink/628567417723406,https://www.factcheck.org/2020/04/conspiracy-theory-misinterprets-goals-of-gates-foundation/,English,FALSE,"The Gates Foundation has advocated for expanded testing and has funded vaccine research, but neither of those involves implanted microchips.",conspiracy theory,['United States'],facebook.com,https://www.facebook.com/groups/346378325942318/permalink/628567417723406,facebook.com,4/9/20,"['gates', 'plotting', 'use', 'covid', 'testing', 'future', 'vaccine', 'track', 'people', 'microchips']"
3852,4/9/20,United States,,,,United States,PolitiFact,"“Church services can’t resume until we’re all vaccinated, says Bill Gates.”",Bloggers,https://web.archive.org/web/20200414121728/https://pulpitandpen.org/2020/04/09/church-services-cant-resume-until-were-all-vaccinated-says-bill-gates/,https://www.politifact.com/factchecks/2020/apr/13/blog-posting/no-bill-gates-didnt-say-no-church-services-until-e/,English,FALSE,"Asked what it would look like when communities start opening up again, Bill Gates said: “Which activities have, like schools, have such benefit and can be done in a way that the risk of transmission is very low? And which activities like mass gatherings may be, in a certain sense, more optional. And so until you’re widely vaccinated, those may not come back at all.”",other,['United States'],archive.org,https://pulpitandpen.org/2020/04/09/church-services-cant-resume-until-were-all-vaccinated-says-bill-gates/,pulpitandpen.org,4/9/20,"['church', 'services', 'resume', 'vaccinated', 'says', 'gates']"
6092,4/10/20,Ukraine,,,,Ukraine,VoxCheck,Bill Gates profits from vaccination and wants to reduce the world's population.,Facebook,https://www.facebook.com/story.php?story_fbid=118515893140997&id=100049477597212,https://voxukraine.org/uk/fejk-bill-gejts-nazhivayetsya-na-vaktsinatsiyi-i-mriye-skorotiti-naselennya-planeti/,Ukrainian,FALSE,"It is not true. Bill & Melinda Gates Foundation, on the contrary, spends money on immunization.",conspiracy theory,['Ukraine'],facebook.com,https://www.facebook.com/story.php?story_fbid=118515893140997&id=100049477597212,facebook.com,4/10/20,"['gates', 'profits', 'vaccination', 'wants', 'reduce', 'world', 'population']"
4006,4/11/20,United States,,,,United States ,LeadStories,U.S. government planning to force Americans to take vaccinations during the coronavirus pandemic with the help of Bill Gates.,facebook,https://www.facebook.com/watch/?v=589595028569342,https://leadstories.com/hoax-alert/2020/04/fact-check-us-is-not-planning-to-force-vaccinations-with-bill-gates-amid-coronavirus.html,English,FALSE,The video was taken from InfoWars and there is no evidence this will happen.,conspiracy theory,['United States'],facebook.com,https://www.facebook.com/watch/?v=589595028569342,facebook.com,4/11/20,"['government', 'planning', 'force', 'americans', 'vaccinations', 'coronavirus', 'pandemic', 'help', 'gates']"
5723,4/11/20,Ghana,,,,Ghana,Dubawa,A Facebook post claimed that Bill Gates says there will be no public/mass gatherings in the light of COVID-19 pandemic until everyone is vaccinated.,Facebook,https://www.facebook.com/photo.php?fbid=2595083037415296&set=a.1593428900914053&type=3&theater&_rdc=1&_rdr,https://ghana.dubawa.org/again-media-reports-misrepresented-bill-gates-comment-on-mass-gathering-vaccination/,English,FALSE,"A comment by Bill Gates during an interview was misrepresented. Mr Gates, in response to a question, said the U.S. government needs to prioritise and decide which activities to allow should it decide to open up the country after weeks of lockdown. Mass gatherings, he said, is not an option now and might not come back until people are widely vaccinated.",conspiracy theory,['Ghana'],facebook.com,https://www.facebook.com/photo.php?fbid=2595083037415296&set=a.1593428900914053&type=3&theater&_rdc=1&_rdr,facebook.com,4/11/20,"['facebook', 'post', 'claimed', 'gates', 'says', 'public', 'mass', 'gatherings', 'light', 'covid', 'pandemic', 'vaccinated']"
5000,4/12/20,Greece,,,,Greece,Ellinika Hoaxes,Bill Gates plans to introduce microchip implants that will register whether or not someone has been tested and/or vaccinated against SARS-CoV-2.,Various news sites,Unavaliable,https://www.ellinikahoaxes.gr/2020/04/12/bill-gates-covid19-microchip/,Greek,FALSE,Neither the technology of quantum dots nor the ID2020 program have anything to do with implantable micro-chips nor were they originaly developed in response to the new coronavirus.,conspiracy theory,['Greece'],N/A,Unavaliable,N/A,4/12/20,"['gates', 'plans', 'introduce', 'microchip', 'implants', 'register', 'tested', 'vaccinated', 'sars', 'cov']"
5128,4/12/20,Russia,Kazakhstan,Kyrgyzstan,,"Russia, Kazakhstan, Kyrgyzstan",Factcheck.kz,Bill Gates has effectively taken over the World Health Organization.,Delyagin.ru,https://delyagin.ru/articles/183-sobytija/78390-doktor-smert-zachem-bill-geyts-fakticheski-zakhvatil-vsemirnuju-organizatsiju-zdravookhranenija-voz-i-pri-chem-zdes-koronabesie?fbclid=IwAR3Nyd0jcGuCciOiH_r89mwadXmGbsrKoZSxOMggSucNBuf1xMiFhuGtY18,https://factcheck.kz/claim-checking/verdict/faktchek-vse-grexi-billa-gejtsa-sataninskaya-vakcinaciya-chipirovanie-i-prochee/,Russian,FALSE,This claim is part of a baseless anti-vaccination conspiracy theory.,conspiracy theory,"['Russia', 'Kazakhstan', 'Kyrgyzstan']",delyagin.ru,https://delyagin.ru/articles/183-sobytija/78390-doktor-smert-zachem-bill-geyts-fakticheski-zakhvatil-vsemirnuju-organizatsiju-zdravookhranenija-voz-i-pri-chem-zdes-koronabesie?fbclid=IwAR3Nyd0jcGuCciOiH_r89mwadXmGbsrKoZSxOMggSucNBuf1xMiFhuGtY18,delyagin.ru,4/12/20,"['gates', 'effectively', 'taken', 'world', 'health', 'organization']"
4025,4/12/20,United States,,,,United States,PolitiFact,Says American NIAID director Dr. Anthony Fauci “stands to lose 100 million dollars on Bill Gates ‘vaccine’ for the coronavirus. Because he invested in this vaccine.”,Facebook posts,https://archive.fo/LCunc,https://www.politifact.com/factchecks/2020/apr/15/facebook-posts/facebook-posts-falsely-claim-dr-fauci-has-millions/,English,FALSE,There is no evidence that Dr. Anthony Fauci is personally financially invested in a coronavirus vaccine.,conspiracy theory,['United States'],archive.fo,https://www.facebook.com/AP.i.am.awake/photos/a.2273198979374324/3365236183503926/?type=3,facebook.com,4/12/20,"['says', 'american', 'niaid', 'director', 'anthony', 'fauci', 'stands', 'lose', '100', 'million', 'dollars', 'gates', 'vaccine', 'coronavirus', 'invested', 'vaccine']"
5127,4/12/20,Russia,Kazakhstan,Kyrgyzstan,,"Russia, Kazakhstan, Kyrgyzstan",Factcheck.kz,"Microsoft co-founder Bill Gates will release human-implantable capsules with ""digital certificates"" that can show who has been tested for coronavirus and who has been vaccinated.",Biohack.info,https://biohackinfo.com/news-bill-gates-id2020-vaccine-implant-covid-19-digital-certificates/,https://factcheck.kz/claim-checking/verdict/faktchek-vse-grexi-billa-gejtsa-sataninskaya-vakcinaciya-chipirovanie-i-prochee/,Russian,FALSE,This claim is part of a baseless anti-vaccination conspiracy theory.,conspiracy theory,"['Russia', 'Kazakhstan', 'Kyrgyzstan']",biohackinfo.com,https://biohackinfo.com/news-bill-gates-id2020-vaccine-implant-covid-19-digital-certificates/,biohackinfo.com,4/12/20,"['microsoft', 'founder', 'gates', 'release', 'human', 'implantable', 'capsules', 'digital', 'certificates', 'tested', 'coronavirus', 'vaccinated']"
4118,4/13/20,United States,,,,United States,PolitiFact,"The Gates Foundation ""tested a polio vax in India between 2000 & 2017 and paralysed 496,000 children.""",Facebook,https://archive.is/78Y3c,https://www.politifact.com/factchecks/2020/apr/23/facebook-posts/anti-vaxxers-spread-conspiracy-about-bill-gates-an/,English,FALSE,"The Gates Foundation has long supported polio vaccination efforts in India. There is no evidence that 496,000 children were paralyzed due to a polio vaccine.",conspiracy theory,['United States'],archive.is,https://www.facebook.com/kay.shemirani/posts/10222568001978996,facebook.com,4/13/20,"['gates', 'foundation', 'tested', 'polio', 'vax', 'india', '2000', '2017', 'paralysed', '496', '000', 'children']"
6290,4/13/20,Czech Republic,Canada,,,"Czech Republic, Canada",AFP,"Social media posts and online articles shared tens of thousands of times claim that the foundation of billionaire philanthropist Bill Gates tested a polio vaccine in India that left at least 490,000 children paralyzed.",FB,https://perma.cc/EX8K-39TJ,https://factcheck.afp.com/gates-foundation-targeted-misleading-claims-about-india-polio-vaccine-campaign,English,misleading,The claim is misleading; official statistics show only a tiny number of cases in which the oral polio vaccine directly resulted in Indian children contracting the disease.,conspiracy theory,"['Czech Republic', 'Canada']",perma.cc,https://www.facebook.com/kay.shemirani/posts/10222568001978996,facebook.com,4/13/20,"['social', 'media', 'posts', 'online', 'articles', 'shared', 'tens', 'thousands', 'times', 'claim', 'foundation', 'billionaire', 'philanthropist', 'gates', 'tested', 'polio', 'vaccine', 'india', 'left', '490', '000', 'children', 'paralyzed']"
4196,4/14/20,Nigeria,West Africa,,,"Nigeria, West Africa",AfricaCheck,"A French doctor is quoted as saying that US billionaire Bill Gates wants to sell a COVID-19 vaccine in Africa, but it's poisonous and will ""destroy"" Africa. ","Facebook, WhatsApp",https://web.facebook.com/photo?fbid=10157546470462203&set=a.123090557202,https://africacheck.org/fbcheck/bill-gates-not-testing-covid-19-vaccine-in-africa/,English,FALSE,"The quote in the post is attributed to French doctor Didier Raoult, but he has denied making any such statements about a coronavirus vaccine or Bill Gates. WHO director general, Tedros Adhanom Ghebreyesus, has said that Africa ""can't and won't be a testing ground for any vaccine"", and there is no evidence that the coronavirus vaccine currently being developed with support from the Gates Foundation and other partners will be tested in Africa.",conspiracy theory,"['Nigeria', 'West Africa']",facebook.com,https://web.facebook.com/photo?fbid=10157546470462203&set=a.123090557202,facebook.com,4/14/20,"['french', 'doctor', 'quoted', 'saying', 'billionaire', 'gates', 'wants', 'sell', 'covid', 'vaccine', 'africa', 'poisonous', 'destroy', 'africa']"
4263,4/15/20,Croatia,,,,Croatia,Faktograf,The pandemic is a fake excuse for Bill Gates to implant microchips into the global population.,Facebook post,https://archive.li/FPBBp,https://faktograf.hr/2020/04/15/ne-bill-gates-vam-ne-zeli-ugraditi-mikrocip-id2020/,Croatian,FALSE,The pandemic is very much real and the ID2020 project has nothing to do with implanting microchips.,conspiracy theory,['Croatia'],archive.li,https://www.facebook.com/photo?fbid=2781137251999743&set=a.401946916585467,facebook.com,4/15/20,"['pandemic', 'fake', 'excuse', 'gates', 'implant', 'microchips', 'global', 'population']"
4264,4/15/20,Croatia,,,,Croatia,Faktograf,The pandemic is a fake excuse for Bill Gates to depopulate the Earth.,YouTube video,https://archive.li/mEhJR,https://faktograf.hr/2020/04/15/video-koji-navodno-prokazuje-stvarne-namjere-gospodara-planete-billa-gatesa-pun-je-netocnosti/,Croatian,FALSE,Conspiracy theory claiming that Gates wants to depopulate the Earth is based on numerous false claims.,conspiracy theory,['Croatia'],archive.li,https://www.youtube.com/watch?v=PntZi_ZB9z8&fbclid=IwAR2SFoRhhfwq2Ch1Pkm2fv84h1wQ_9b90aFlyOSpQEEvcCPEiexo_2PxDSc,youtube.com,4/15/20,"['pandemic', 'fake', 'excuse', 'gates', 'depopulate', 'earth']"
6367,4/15/20,Poland,,,,Poland,Demagog,"Bill Gates wants to implant microchips in vaccines using the ""ID2020 Alliance"".","Facebook posts, articles",https://www.facebook.com/globalneoslepienie/posts/2693873817390085,https://demagog.org.pl/analizy_i_raporty/nie-bill-gates-nie-chce-wszczepiac-nam-mikroczipow-w-szczepionkach/,Polish,FALSE,ID2020 has nothing to do with microchips. There is no evidence of proposed usage of microchips in currently developed vaccines.,conspiracy theory,['Poland'],facebook.com,https://www.facebook.com/globalneoslepienie/posts/2693873817390085,facebook.com,4/15/20,"['gates', 'wants', 'implant', 'microchips', 'vaccines', 'id2020', 'alliance']"
4320,4/16/20,Croatia,,,,Croatia,Faktograf,"The pandemic is a lie, COVID-19 can be cured with vitamin C and Bill Gates is behind it all.",Facebook post,https://archive.li/1Bbth,https://faktograf.hr/2020/04/16/pandemija-nije-laz-iza-koje-stoji-bill-gates-niti-se-covid-19-lijeci-vitaminom-c/?fbclid=IwAR0BkMRTTP1xJ5n_uPgg2nGz1uB0BB3AMYYw4gYFt055UTdc-KDGn5yAOSs,Croatian,FALSE,The conspiracy theory is based on numerous false claims.,conspiracy theory,['Croatia'],archive.li,https://www.facebook.com/RIprijenosi/photos/a.504703396579052/1064102940639092/?type=3&theater,facebook.com,4/16/20,"['pandemic', 'lie', 'covid', 'cured', 'vitamin', 'gates']"
4350,4/16/20,United States,,,,United States ,LeadStories,"Bill Gates free to prescribe drugs while the late herbalist, ""Dr. Sebi,"" was not allowed to heal people with herbs.",Facebook,https://www.facebook.com/taundra.durallford/posts/267292367645487,https://leadstories.com/hoax-alert/2020/04/Fact-Check-Bill-Gates-Can-NOT-Prescribe-Medicine-And-'Dr-Sebi'-Was-Barred-From-Practicing-In-Some-States.html,English,FALSE,"Bill Gates cannot prescribe any medication because he is not a medial doctor, thought doctor's hired by his foundation can since they have an MD.",,['United States'],facebook.com,https://www.facebook.com/taundra.durallford/posts/267292367645487,facebook.com,4/16/20,"['gates', 'free', 'prescribe', 'drugs', 'late', 'herbalist', 'sebi', 'allowed', 'heal', 'people', 'herbs']"
4408,4/17/20,United States,,,,United States ,LeadStories,"Bill Gates, the WHO and the World Bank lost billions to Trump amid the coronavirus outbreak.",Helena Nationallist Voice,https://helenaglass.wpcomstaging.com/2020/04/17/gates-who-world-bank-just-lost-billions-as-president-trump-trumped/?fbclid=IwAR0V1n_BUQofeMYn3hqg77Vs457rJSw57OrdwvlqckhZ5BEeLMO4T5dKEsw,https://leadstories.com/hoax-alert/2020/04/fact-check-bill-gates-who-and-world-bank-not-trumped-by-trump-amid-coronavirus.html,English,FALSE,"This article is fraught with inaccuracies about financials related to the coronavirus, which can all be disproven.",conspiracy theory,['United States'],wpcomstaging.com,https://helenaglass.wpcomstaging.com/2020/04/17/gates-who-world-bank-just-lost-billions-as-president-trump-trumped/?fbclid=IwAR0V1n_BUQofeMYn3hqg77Vs457rJSw57OrdwvlqckhZ5BEeLMO4T5dKEsw,wpcomstaging.com,4/17/20,"['gates', 'world', 'bank', 'lost', 'billions', 'trump', 'amid', 'coronavirus', 'outbreak']"
4522,4/20/20,United States,,,,United States,PolitiFact,"The Gates Foundation ""has the patent for this coronavirus.""",Facebook,https://archive.fo/i0N17,https://www.politifact.com/factchecks/2020/apr/23/facebook-posts/gates-foundation-does-not-have-patent-coronavirus/,English,FALSE,The Gates Foundation doesn't have any patents related to the novel coronavirus. The philanthropic organization is funding the development of potential vaccines for COVID-19.,conspiracy theory,['United States'],archive.fo,https://www.facebook.com/photo.php?fbid=10158450897728057&set=a.10150961547628057&type=3,facebook.com,4/20/20,"['gates', 'foundation', 'patent', 'coronavirus']"
4534,4/20/20,Canada,,,,Canada,Décrypteurs - Radio-Canada,"Bill Gates wants to implement microchips, to depopulate the planet and he is sued in India for killing people with vaccines.",Dr Schmitz,https://drschmitz.lettre-medecin-sante.com/pret-a-etre-puce/,https://ici.radio-canada.ca/nouvelle/1698428/bill-gates-puce-conspiration-complot-covid-verification-dementi-decrypteurs,French,FALSE,"Bill Gates mentioned a digital certificate to track who has recovered from COVID-19, who has been tested and who has been vaccinated, but it's not a microchip. He also mentioned he wanted the demographic growth to slow down, but not to reduce global population. Finally, seven kids who were part of a vaccination program in India died, but their cause of death was not related to the vaccine.",conspiracy theory,['Canada'],lettre-medecin-sante.com,https://drschmitz.lettre-medecin-sante.com/pret-a-etre-puce/,lettre-medecin-sante.com,4/20/20,"['gates', 'wants', 'implement', 'microchips', 'depopulate', 'planet', 'sued', 'india', 'killing', 'people', 'vaccines']"
5125,4/20/20,Russia,Kazakhstan,Kyrgyzstan,,"Russia, Kazakhstan, Kyrgyzstan",Factcheck.kz,Bill Gates is detained as the creator of the coronavirus.,News channels,https://argument.kg/?p=52894,https://factcheck.kz/claim-checking/verdict/bill-gejts-zaderzhan-kak-sozdatel-koronavirusa-chto-sluchilos-na-samom-dele/,Russian,FALSE,"Distortion of the original source information. The original article states that the Microsoft co-founder-turned-philanthropist was falsely accused of creating a coronavirus and wanting to profit from it. The reason for the ""information attack"" was a speech by Gates in 2015, where he warned that the greatest danger to humanity is not a nuclear war, but an infectious virus that can threaten the lives of millions of people",conspiracy theory,"['Russia', 'Kazakhstan', 'Kyrgyzstan']",argument.kg,https://argument.kg/?p=52894,argument.kg,4/20/20,"['gates', 'detained', 'creator', 'coronavirus']"
5804,4/22/20,Taiwan,,,,Taiwan,Taiwan FactCheck Center,"According to the documents leaked out from Bill Gates foundation, Chinese scientist, Mrs. Shih Zhengli is responsible for releasing the COVID-19 by placing a piece of polluted day ice near the Wuhan seafood market.",Facebook,https://www.facebook.com/shrinetaiwan/posts/3170102289669401,https://tfc-taiwan.org.tw/articles/3825,Chinese (traditional),FALSE,"Bill Gates denied having a data breach currently. The geographic description of the Wuhan seafood market in the claim is false
",conspiracy theory,['Taiwan'],facebook.com,https://www.facebook.com/shrinetaiwan/posts/3170102289669401,facebook.com,4/22/20,"['according', 'documents', 'leaked', 'gates', 'foundation', 'chinese', 'scientist', 'mrs', 'shih', 'zhengli', 'responsible', 'releasing', 'covid', 'placing', 'piece', 'polluted', 'day', 'ice', 'near', 'wuhan', 'seafood', 'market']"
4638,4/22/20,France,United States,Africa,,"France, United States, Africa",franceinfo,"
Bill Gates is creating a vaccine against the COVID-19 which would geolocate the population.",Facebook/Twitter/Instagram/Websites,https://www.infowars.com/?s=bill%20gates,https://www.francetvinfo.fr/monde/usa/vrai-ou-fake-bill-gates-developpe-t-il-reellement-un-vaccin-contre-le-covid-19-qui-geolocaliserait-la-population_3927797.html,French,FALSE,The Bill Gates Foundation funded research on an invisible ink technology that could help to keep vaccination record in developing countries but this was not a tracking device.,conspiracy theory,"['France', 'United States', 'Africa']",infowars.com,https://www.infowars.com/?s=bill%20gates,infowars.com,4/22/20,"['gates', 'creating', 'vaccine', 'covid', 'geolocate', 'population']"
6599,4/24/20,Bosnia and Herzegovina,Serbia ,,,"Bosnia and Herzegovina, Serbia",Raskrinkavanje,"Half a million of people are demanding investigation on Bill Gates charging him with crimes against humanity, An investigation from the White House is on the way.",Online Media ,https://rs-lat.sputniknews.com/svet/202004241122429378-skoro-pola-miliona-amerikanaca-trazi-pokretanje-istrage-protiv-bila-gejtsa-i-njegove-supruge/,https://raskrinkavanje.ba/analiza/sta-zaista-znaci-peticija-protiv-billa-gatesa,Bosnian,FALSE,"The Serbian version of Sputnik published an article about the petition on the website of the White House against the Bill and Melinda Gates Foundation, which was signed by over 425,000 people and which requires an investigation into the public debate in the US Congress. Various media outlets have added new inaccurate claims to the news, such Bill gates will be ""charged for the crime"", that investigation is ""on the way"" and that the White House ""decides about Gates' fate"". This petition contains inaccurate claims about Gates and other conspiracy theories, but this has not prevented many portals from reporting about its content completely uncritically, or with the addition of new disinformation. Our conclusions show that every person at the age of 13 has the legal requirements to initiate a petition through this platform. Some demands are Sarcastic, like a petition saying that Alaska should be returned to Russia. ",conspiracy theory,"['Bosnia and Herzegovina', 'Serbia']",sputniknews.com,https://rs-lat.sputniknews.com/svet/202004241122429378-skoro-pola-miliona-amerikanaca-trazi-pokretanje-istrage-protiv-bila-gejtsa-i-njegove-supruge/,sputniknews.com,4/24/20,"['half', 'million', 'people', 'demanding', 'investigation', 'gates', 'charging', 'crimes', 'humanity', 'investigation', 'white', 'house', 'way']"
5554,4/24/20,Greece,,,,Greece,Ellinika Hoaxes,Bill Gates said in a TV interview that people don't have a choice when it comes to vaccination for COVID-19.,"Blogs, News",Unavaliable,https://www.ellinikahoaxes.gr/2020/04/24/bill-gates-gia-pagkosmio-emvoliasmo/,Greek,FALSE,"When Bill Gates was saying that ""people don't have a choice"" he was refering to the economic consequenses of the pandemic that will affect everyone as it is clearly stated his interview.",conspiracy theory,['Greece'],N/A,Unavaliable,N/A,4/24/20,"['gates', 'said', 'interview', 'people', 'choice', 'comes', 'vaccination', 'covid']"
6264,4/27/20,France,,,,France,AFP,A vaccine against polio funded by Bill Gates has paralysed almost 500 000 children in India between 2000 and 2017.,Social Media,https://perma.cc/GQ6U-R5ZZ?type=image,https://factuel.afp.com/non-le-vaccin-contre-la-polio-promu-par-bill-gates-na-pas-paralyse-pres-de-500-000-enfants-en-inde,French,FALSE,"Foundation Gates denies this claim, and data provided by WHO shows only 17 cases of vaccine-associated paralytic polio since 2000 in India.",conspiracy theory,['France'],perma.cc,https://www.facebook.com/groups/niburu/permalink/3308426749191262/,facebook.com,4/27/20,"['vaccine', 'polio', 'funded', 'gates', 'paralysed', '500', '000', 'children', 'india', '2000', '2017']"
4860,4/28/20,United States,,,,United States ,LeadStories,"Sign outside the Bill & Melinda Gates Foundation says ""Center for Global Human Population Reduction.""",facebook,https://www.facebook.com/photo.php?fbid=10163568200740261&set=a.10153619676750261&type=3&theater,https://leadstories.com/hoax-alert/2020/04/fact-check-bill-and-melinda-gates-foundation-hq-does-not-read-center-for-global-human-population-reduction.html,English,FALSE,"There is no such center run by Gates -- nor is there any evidence such a center exists anywhere, run by anyone.",other,['United States'],facebook.com,https://www.facebook.com/photo.php?fbid=10163568200740261&set=a.10153619676750261&type=3&theater,facebook.com,4/28/20,"['sign', 'outside', 'melinda', 'gates', 'foundation', 'says', 'center', 'global', 'human', 'population', 'reduction']"
4896,4/29/20,Georgia,,,,Georgia ,Myth Detector,Bill Gates is creating vaccines to make the earth's population infertile. He discussed a plan to reduce the world's population through vaccines during his 2010 TED talk.,online media,http://geworld.ge/ge/%E1%83%91%E1%83%98%E1%83%9A-%E1%83%92%E1%83%94%E1%83%98%E1%83%A2%E1%83%A1%E1%83%98-%E1%83%95%E1%83%90%E1%83%A5%E1%83%AA%E1%83%98%E1%83%9C%E1%83%94%E1%83%91%E1%83%A1-%E1%83%90%E1%83%93%E1%83%90/,http://mythdetector.ge/ka/myth/gvpirdeba-tu-ara-bil-geitsi-depopulatsias-da-chipizatsias,Georgian,misleading,Bill Gates' quote is taken out of context. He discussed production of vaccines to reduce the death rate of children in developing countries.,conspiracy theory,['Georgia'],geworld.ge,http://geworld.ge/ge/%E1%83%91%E1%83%98%E1%83%9A-%E1%83%92%E1%83%94%E1%83%98%E1%83%A2%E1%83%A1%E1%83%98-%E1%83%95%E1%83%90%E1%83%A5%E1%83%AA%E1%83%98%E1%83%9C%E1%83%94%E1%83%91%E1%83%A1-%E1%83%90%E1%83%93%E1%83%90/,geworld.ge,4/29/20,"['gates', 'creating', 'vaccines', 'earth', 'population', 'infertile', 'discussed', 'plan', 'reduce', 'world', 'population', 'vaccines', '2010', 'ted', 'talk']"
6019,4/30/20,United States,,,,United States,AFP,"An article circulating on Facebook claims that Microsoft co-founder Bill Gates said a COVID-19 vaccine could kill almost one million people, citing an interview he gave.",FB,https://perma.cc/QN6C-T445,https://factcheck.afp.com/bill-gates-did-not-say-covid-19-vaccine-could-kill-nearly-million-people,English,FALSE,"This is false; Gates was talking about vaccine safety and the potential for side effects, and gave a hypothetical figure to illustrate the number of people who could possibly be affected by them worldwide.",conspiracy theory,['United States'],perma.cc,https://cloverchronicle.com/2020/04/30/watch-bill-gates-admits-his-covid-19-vaccine-might-kill-nearly-1000000-people/?fbclid=IwAR2KQGOCHOXlTv82il1MY5W8Qcekvof7b-qTHrH5tF2JH0OnM9oomnLM-oU,cloverchronicle.com,4/30/20,"['article', 'circulating', 'facebook', 'claims', 'microsoft', 'founder', 'gates', 'said', 'covid', 'vaccine', 'kill', 'million', 'people', 'citing', 'interview', 'gave']"
