,date,country_1,country_2,country_3,country_4,countries,organization,claim,source,source_url,fact_check_url,fact_check_lang,final_rating,explanation,category,countries_list,source_domain,resolved_url,resolved_domain,datetime,claim_p
6501,5/29/20,Ireland,,,,Ireland,TheJournal.ie,"Bill Gates, Melinda Gates, Anthony Fauci and the WHO are being charged with genocide.",Facebook posts,https://www.facebook.com/groups/2297192787251637/permalink/2323115821326000/,https://www.thejournal.ie/bill-gates-anthony-fauci-debunk-genocide-factcheck-5110920-May2020/,English,FALSE,"Bill Gates, Melinda Gates, Anthony Fauci and the WHO are not being charged with genocide. ",conspiracy theory,['Ireland'],facebook.com,https://www.facebook.com/groups/2297192787251637/permalink/2323115821326000/,facebook.com,5/29/20,"['gates', 'melinda', 'gates', 'anthony', 'fauci', 'charged', 'genocide']"
6806,5/30/20,Colombia,,,,Colombia,Colombiacheck,Italian politician asked to take Bill Gates to the International Criminal Court.,website,http://archive.vn/WyonP,https://colombiacheck.com/chequeos/politica-italiana-que-pidio-llevar-bill-gates-ante-la-corte-penal-internacional-dijo,Spanish,FALSE,Sara Cunial's speech to the Italian parliament on the management of COVID-19 went viral. But it is full of misinformation and conspiracy theories.,conspiracy theory,['Colombia'],archive.vn,https://mundopoder.com/escandalo-fuerte-denuncia-en-el-parlamento-italiano/,mundopoder.com,5/30/20,"['italian', 'politician', 'asked', 'gates', 'international', 'criminal', 'court']"
7385,5/30/20,New Zealand,,,,New Zealand,AFP,Multiple Facebook posts shared hundreds of times claim that Bill Gates’ “ultimate goal” is to “microchip the [COVID-19] vaccine” to create “virtual IDs”. The posts also claim the billionaire philanthropist was in New Zealand in May and June 2020 “to test and trial the COVID-19 vaccine”.,FB,https://perma.cc/3L5R-K3FS,https://factcheck.afp.com/hoax-about-bill-gates-plan-microchip-vaccine-circulates-online,English,FALSE,"Both claims are false; a Bill & Melinda Gates Foundation spokesperson dismissed the purported link between Gates and microchips; as of June 24, New Zealand authorities say there is no record of Gates visiting the country in 2020.",conspiracy theory,['New Zealand'],perma.cc,https://www.facebook.com/photo.php?fbid=2745744775657252&set=a.1390752697823140&type=3&theater,facebook.com,5/30/20,"['multiple', 'facebook', 'posts', 'shared', 'hundreds', 'times', 'claim', 'gates', 'ultimate', 'goal', 'microchip', 'covid', 'vaccine', 'create', 'virtual', 'ids', 'posts', 'claim', 'billionaire', 'philanthropist', 'new', 'zealand', 'june', '2020', 'test', 'trial', 'covid', 'vaccine']"
6753,6/2/20,Latvia,,,,Latvia,Re:Check,"Donald Trump has stopped 5G, has canceled Bill Gates' ID2020 and H.R. 6666 COVID-19 Trace bill. ",Facebook,https://www.facebook.com/photo.php?fbid=1884126591718075&set=a.733328656797880&type=3&theater,https://rebaltica.lv/2020/06/trampam-piedevetie-lemumi-maldinosa-informacija/,Latvian,misleading,Deployment of 5G network has not been stopped.  ID2020 and H.R. 6666 COVID-19 Trace bill are not canceled. Those and other claims in a popolar post circulating on Facebook in English and Latvian are false or misleading. ,spread,['Latvia'],facebook.com,https://www.facebook.com/photo.php?fbid=1884126591718075&set=a.733328656797880&type=3&theater,facebook.com,6/2/20,"['donald', 'trump', 'stopped', 'canceled', 'gates', 'id2020', '6666', 'covid', 'trace']"
7014,6/3/20,Spain,,,,Spain,Newtral.es,"Bill Gates says that the COVID-19 vaccine could kill 700,000 people.",News website,Unavaliable,https://www.newtral.es/bulo-bill-gates-vacuna-covid-19-podria-matar-700-000-personas/20200603/,Spanish,FALSE,The statement was manipulated.,conspiracy theory,['Spain'],N/A,Unavaliable,N/A,6/3/20,"['gates', 'says', 'covid', 'vaccine', 'kill', '700', '000', 'people']"
6889,6/4/20,United States,,,,United States,Science Feedback,Bill Gates' coronavirus vaccine developed by Oxford researchers caused all test subjects to get coronavirus.,"Anonymous, Montana Daily Gazette",http://archive.vn/HFNI2#,https://healthfeedback.org/claimreview/article-inaccurately-claims-that-coronavirus-vaccine-by-oxford-researchers-caused-animal-test-subjects-to-develop-covid-19/,English,FALSE,"Vaccinated animals did not develop an infection because of the vaccine, contrary to the claim. Preliminary results from small-scale animal studies suggest that the COVID-19 vaccine developed by Oxford researchers may protect against viral pneumonia. However, researchers did find viral genetic material in nasal passages of vaccinated monkeys. Therefore, some scientists have cautioned that the vaccine may provide only partial protection against disease and may not prevent virus shedding and its spread to unvaccinated individuals. Bill Gates is not the developer, producer or sole funder of the vaccine; financial backing for the production of the Oxford vaccine has come from several sources including the U.K. government. It is inaccurate and misleading to attribute the vaccine to Bill Gates alone.",other,['United States'],archive.vn,https://montanadailygazette.com/2020/05/27/all-test-subjects-of-bill-gates-vaccine-ended-up-with-coronavirus/,montanadailygazette.com,6/4/20,"['gates', 'coronavirus', 'vaccine', 'developed', 'oxford', 'researchers', 'caused', 'test', 'subjects', 'coronavirus']"
6903,6/7/20,United States,,,,United States,AFP,Facebook posts shared thousands of times claim the coronavirus pandemic is a cover for a Gates Foundation-funded effort to implant microchips when patients’ noses or throats are swabbed during COVID-19 testing.,FB,https://perma.cc/Z23S-HCKR,https://factcheck.afp.com/posts-falsely-claim-coronavirus-testing-excuse-implant-gates-funded-microchips,English,FALSE,"This is false; the pandemic is real, the foundation denied the claim, and experts say there is a medical reason for the way swabs are used when testing for the disease.",conspiracy theory,['United States'],perma.cc,https://www.facebook.com/photo.php?fbid=10216252022228393&set=a.1600744053668&type=3&theater,facebook.com,6/7/20,"['facebook', 'posts', 'shared', 'thousands', 'times', 'claim', 'coronavirus', 'pandemic', 'cover', 'gates', 'foundation', 'funded', 'effort', 'implant', 'microchips', 'patients', 'noses', 'throats', 'swabbed', 'covid', 'testing']"
7081,6/9/20,Mexico,,,,Mexico,Animal Político,Bill Gates was expelled from India due to his Polio vaccines.,facebook,https://www.facebook.com/photo.php?fbid=1654841917987727&set=a.562111020594161&type=3&theater,https://www.animalpolitico.com/elsabueso/bill-gates-no-fue-expulsado-de-india-por-sus-vacunas-contra-la-polio/,Spanish,FALSE,There is no evidence that polio vaccines in India cause paralysis on children and Bill Gates was not prohibited access in consequence.,conspiracy theory,['Mexico'],facebook.com,https://www.facebook.com/photo.php?fbid=1654841917987727&set=a.562111020594161&type=3&theater,facebook.com,6/9/20,"['gates', 'expelled', 'india', 'polio', 'vaccines']"
7075,6/10/20,Colombia,,,,Colombia,Colombiacheck,"Spanish musician Miguel Bosé posted a Twitter thread pointing to the expulsion of the Gates Foundation and GAVI ‘pharmaceutical’ from India, polio and HPV vaccines and the implementation of a microchip vaccine.",Twitter,http://archive.is/0ChLZ,https://colombiacheck.com/chequeos/las-afirmaciones-falsas-de-miguel-bose-sobre-la-fundacion-gates-los-microchips-y-la-red-5g,Spanish,FALSE,"None of the allegations that Miguel Bosé posted in a Twitter thread about the expulsion of the Gates Foundation and GAVI ‘pharmaceutical ’from India, polio and HPV vaccines, and the implementation of microchip vaccines are supported.",conspiracy theory,['Colombia'],archive.is,https://twitter.com/BoseOfficial/status/1270382117545893888,twitter.com,6/10/20,"['spanish', 'musician', 'miguel', 'bosé', 'posted', 'twitter', 'thread', 'pointing', 'expulsion', 'gates', 'foundation', 'gavi', 'pharmaceutical', 'india', 'polio', 'hpv', 'vaccines', 'implementation', 'microchip', 'vaccine']"
6882,6/10/20,Argentina,Spain,,,"Argentina, Spain",Chequeado,"Singer Miguel Bosé's tweets involving Bill Gates, vaccines and 5G.","Twitter, Facebook",https://chequeado.com/wp-content/uploads/2020/06/97-1280x549.png,https://chequeado.com/el-explicador/los-mensajes-falsos-de-miguel-bose-que-involucran-a-bill-gates-las-vacunas-y-el-5g/,Spanish,FALSE,"The Spanish singer published a series of messages in which he claims that a ""pharmaceutical company"" owned by the Microsoft co-founder seeks to manufacture vaccines with microchips that can be tracked by 5G. In addition, he assured that for this reason the Bill & Melinda Gates Foundation was expelled from India. However, none of what he says is based on scientific evidence, and they are a compilation of old misinformations along with new ones that emerged from the advance of the new coronavirus pandemic.",conspiracy theory,"['Argentina', 'Spain']",chequeado.com,https://chequeado.com/wp-content/uploads/2020/06/97-1280x549.png,chequeado.com,6/10/20,"['singer', 'miguel', 'bosé', 'tweets', 'involving', 'gates', 'vaccines']"
6934,6/11/20,Argentina,India,Venezuela,,"Argentina, India, Venezuela",Chequeado,Bill Gates faces trial in India for illegally testing vaccines.,"Facebook, Instagram",https://chequeado.com/wp-content/uploads/2020/06/falso-bill-gates-1280x549.png,https://chequeado.com/verificacionfb/es-falso-que-bill-gates-enfrenta-un-juicio-en-la-india-por-probar-vacunas-ilegalmente/,Spanish,FALSE,"The recurrent hoax is that the co-founder of Microsoft and the Bill and Melinda Gates Foundation illegally tested drugs with ""devastating results"" in the health of 30,000 children. This is false. On the contrary, the Prime Minister of India publicly expressed his gratitude to that foundation for the work related to health in that country.",conspiracy theory,"['Argentina', 'India', 'Venezuela']",chequeado.com,https://chequeado.com/wp-content/uploads/2020/06/falso-bill-gates-1280x549.png,chequeado.com,6/11/20,"['gates', 'faces', 'trial', 'india', 'illegally', 'testing', 'vaccines']"
6904,6/11/20,Venezuela,Spain,India,United States,"Venezuela, Spain, India, United States",Efecto Cocuyo,Spanish singer Miguel Bosé accused Gates Foundation to be expelled from India for their vaccines.,Miguel Bosé,https://twitter.com/BoseOfficial/status/1270382117545893888,https://efectococuyo.com/cocuyo-chequea/fundacion-gates-vacunas-fallidas-miguel-bose/,Spanish,FALSE,Gates Foundation still works in India. Bosé based in a IG publication of a critiziced study from 10 years ago,conspiracy theory,"['Venezuela', 'Spain', 'India', 'United States']",twitter.com,https://twitter.com/BoseOfficial/status/1270382117545893888,twitter.com,6/11/20,"['spanish', 'singer', 'miguel', 'bosé', 'accused', 'gates', 'foundation', 'expelled', 'india', 'vaccines']"
6870,6/11/20,Spain,,,,Spain,Maldita.es,"Claims from Spanish singer Miguel Bosé on the Bill and Melinda Gates foundation, that he made last Tuesday, June 9 through a Twitter thread on his personal account.",Facebook/Twitter,Unavaliable,https://twitter.com/BoseOfficial/status/1270382117545893888,Spanish,FALSE,"The Bill and Melinda Gates Foundation has not been expelled from India and neither has the GAVI Alliance, of which the Foundation is one of its main partners. Also, the singer's allegations about vaccines are false.",conspiracy theory,['Spain'],N/A,Unavaliable,N/A,6/11/20,"['claims', 'spanish', 'singer', 'miguel', 'bosé', 'melinda', 'gates', 'foundation', 'tuesday', 'june', 'twitter', 'thread', 'personal', 'account']"
6999,6/12/20,Spain,United States,,,"Spain, United States",Maldita.es,"A photo of the facade of the Bill and Melinda Gates Foundation building that reads, in English, ""Center for Global Human Population Reduction.""",Social media,Unavaliable,https://maldita.es/malditobulo/2020/06/12/foto-edificio-fundacion-bill-melinda-gates-centro-reduccion-global-poblacion-humana/,Spanish,FALSE,"It is a hoax, the photo is a montage and in the building, which is in Seattle (USA), this phrase does not appear.",conspiracy theory,"['Spain', 'United States']",N/A,Unavaliable,N/A,6/12/20,"['photo', 'facade', 'melinda', 'gates', 'foundation', 'building', 'reads', 'english', 'center', 'global', 'human', 'population', 'reduction']"
7219,6/14/20,United States,,,,United States,PolitiFact,"“Six months before the COVID ‘plandemic,’ Bill Gates had negotiated a $100 billion contact tracing deal with (the) Democratic congressman sponsor of bill.”",Facebook posts,https://web.archive.org/save/https://envirowatchrangitikei.wordpress.com/2020/06/14/six-months-before-the-covid-plandemic-bill-gates-had-negotiated-a-100-billion-contact-tracing-deal-with-democratic-congressman-sponsor-of-bill/?fbclid=IwAR2HOuSSUvRRavOA67CtOsg7bzioK-QG2WkNELHmyj3ilT9cWsPFrkgJ4O0,https://www.politifact.com/factchecks/2020/jun/22/facebook-posts/no-evidence-tying-bill-gates-100-billion-covid-19-/,English,FALSE,"There’s no evidence Gates worked with U.S. Rep. Bobby Rush on a $100 billion COVID-19 contact tracing bill months before the COVID-19 outbreak occurred. The bill proposed by Rush would give money not to Gates or his foundation but to organizations that provide COVID-19 testing, contact tracing or other services.",other,['United States'],archive.org,https://envirowatchrangitikei.wordpress.com/2020/06/14/six-months-before-the-covid-plandemic-bill-gates-had-negotiated-a-100-billion-contact-tracing-deal-with-democratic-congressman-sponsor-of-bill/?fbclid=IwAR2HOuSSUvRRavOA67CtOsg7bzioK-QG2WkNELHmyj3ilT9cWsPFrkgJ4O0,wordpress.com,6/14/20,"['months', 'covid', 'plandemic', 'gates', 'negotiated', '100', 'billion', 'contact', 'tracing', 'deal', 'democratic', 'congressman', 'sponsor']"
7241,6/14/20,Italy,India,,,"Italy, India",Digiteye India,The Italian Government wants Bill Gates arrested.,WhatsApp,https://twitter.com/AfricaRepublic/status/1261412197814550533?ref_src=twsrc%5Etfw%7Ctwcamp%5Etweetembed%7Ctwterm%5E1261412197814550533&ref_url=https%3A%2F%2Fdigiteye.in%2Fdoes-the-italian-government-want-bill-gates-arrested-fact-check%2F,https://digiteye.in/does-the-italian-government-want-bill-gates-arrested-fact-check/,English,FALSE,"Amid numerous allegations levelled against the Gates Foundation, this one by an anti-vaccination activist and Italian pariament member, ended to mislead people further.",other,"['Italy', 'India']",twitter.com,https://twitter.com/AfricaRepublic/status/1261412197814550533?ref_src=twsrc%5Etfw%7Ctwcamp%5Etweetembed%7Ctwterm%5E1261412197814550533&ref_url=https%3A%2F%2Fdigiteye.in%2Fdoes-the-italian-government-want-bill-gates-arrested-fact-check%2F,twitter.com,6/14/20,"['italian', 'government', 'wants', 'gates', 'arrested']"
7206,6/15/20,North Macedonia,,,,North Macedonia,Vistinomer,"A Twitter post titled ""Sakam da kazam"": ""July 15 Elections Will Be Used for Vaccinating Voters Through the Project of Bill and Melinda Gates""",twitter post,https://twitter.com/realLOshGZE/status/1272600791304548353,https://crithink.mk/logoto-na-sakam-da-kazham-falsifikuvano-zaradi-shirene-lazhni-vesti/,Macedonian,FALSE,"Such news has never been published on the portal ""Sakam da kazam"", and the photo that manipulates the public is a rough photomontage. There is also a disclaimer about this from the portal's editor.",other,['North Macedonia'],twitter.com,https://twitter.com/realLOshGZE/status/1272600791304548353,twitter.com,6/15/20,"['twitter', 'post', 'titled', 'sakam', 'kazam', 'july', 'elections', 'vaccinating', 'voters', 'project', 'melinda', 'gates']"
7063,6/16/20,Argentina,,,,Argentina,Chequeado,"Bill & Melinda Gates Foundation building says ""Center for Global Human Population Reduction"" on its front.",Social media,https://drive.google.com/file/d/19Qf6A_Ez8ciNSyNr4_9wAj8MVNC9yS-6/view?usp=sharing,https://chequeado.com/verificacionfb/no-la-fachada-de-la-fundacion-bill-melinda-gates-no-dice-centro-para-la-reduccion-de-poblacion-global-de-seres-humanos/,Spanish,FALSE,"The image that circulates on social media is doctored. When searching for the place on Google Maps, it can be seen that the building of the civil organization of the founder of Microsoft does not have any facade like that of the viral image.",conspiracy theory,['Argentina'],google.com,https://drive.google.com/file/d/19Qf6A_Ez8ciNSyNr4_9wAj8MVNC9yS-6/view?usp=sharing,google.com,6/16/20,"['melinda', 'gates', 'foundation', 'building', 'says', 'center', 'global', 'human', 'population', 'reduction']"
7336,6/16/20,United States,,,,United States,Science Feedback,"Bill Gates, who has led harmful vaccination campaigns in developing countries, now plans to use COVID-19 vaccines to surveil the population.","Ty and Charlene Bollinger, The Truth About Cancer",https://archive.fo/UXeTD,https://healthfeedback.org/claimreview/no-bill-gates-is-not-funding-covid-19-vaccines-as-a-way-to-conduct-global-surveillance-or-to-depopulate-the-world/,English,FALSE,"The Bill and Melinda Gates Foundation has committed millions to the improvement of health outcomes in developing countries through vaccination campaigns, becoming a prominent target of the anti-vaccine groups. During the last decade, the foundation has also been involved in the development of health-related technology which, along with its active support of the research of COVID-19 treatments and vaccines during the outbreak, has led to the growth of conspiracy theories worldwide. The claim that Gates wants to use COVID-19 vaccines to track the population is unsupported. The vaccines used in the initiatives funded by the Gates Foundation in Africa and Asia were approved and safe.",conspiracy theory,['United States'],archive.fo,https://thetruthaboutcancer.com/covid-19-conspiracies-vaccines-bill-gates/?fbclid=IwAR0PKaujEmHu3wo14lfD86lHvdbSzJ4SZowiKTXv3PdLRIj8wSXgquIQ-9g,thetruthaboutcancer.com,6/16/20,"['gates', 'led', 'harmful', 'vaccination', 'campaigns', 'developing', 'countries', 'plans', 'use', 'covid', 'vaccines', 'surveil', 'population']"
7097,6/17/20,Italy,,,,Italy,Facta,"A picture with a quote attributed to Bill Gates, stating: ""The vaccine won't be safe, but let's get it out quickly anyway, and worry about the consequences later""",Facebook,https://www.facebook.com/photo.php?fbid=2833027250159419&set=a.107626872699484&type=3&theater,https://facta.news/notizia-falsa/2020/06/17/no-bill-gates-non-ha-mai-detto-che-il-vaccino-contro-la-covid-19-non-sara-sicuro-ma-facciamolo-comunque/,Italian,FALSE,"Bill Gates never said so. The quote comes from an interview Bill Gates did for BBC Breakfast, that has been distorted and misinterpreted.",cures,['Italy'],facebook.com,https://www.facebook.com/photo.php?fbid=2833027250159419&set=a.107626872699484&type=3&theater,facebook.com,6/17/20,"['picture', 'quote', 'attributed', 'gates', 'stating', 'vaccine', 'won', 'safe', 'let', 'quickly', 'worry', 'consequences', 'later']"
7113,6/17/20,India,,,,India,Vishvas News,Gates Foundation planting microchips during COVID19 swab testing.,Facebook,https://archive.md/wip/d3XrB,https://www.vishvasnews.com/english/health/fact-check-post-claiming-gates-foundation-planting-microchips-during-covid19-swab-testing-is-fake/,English,FALSE,"No, Gates Foundation is not planting microchips during COVID-19 swab testing. This viral post is fake.",conspiracy theory,['India'],archive.md,https://www.facebook.com/deborah.janney/posts/3604286149586283,facebook.com,6/17/20,"['gates', 'foundation', 'planting', 'microchips', 'covid19', 'swab', 'testing']"
7197,6/18/20,Indonesia,,,,Indonesia,TEMPO,WHO establishes COVID-19 as a pandemic the day after receiving donations from Bill Gates.,Washington Times opinion editor Cheryl Chumley in a Fox News interview,https://archive.ph/1U1Tb#selection-5257.0-5265.225,https://cekfakta.tempo.co/fakta/838/fakta-atau-hoaks-benarkah-who-tetapkan-covid-19-sebagai-pandemi-sehari-setelah-terima-sumbangan-bill-gates,Bahasa Indonesia,FALSE,"Bill Gates' first contribution to WHO regarding COVID-19 was made in February 2020, long before the pandemic was established. The second Bill Gates contribution was made in April 2020, after US President Donald Trump stopped funding for WHO. Regarding the designation of COVID-19 as a pandemic, this was done because the level of distribution and the number of victims had increased. In theory, COVID-19 also meets the criteria as a pandemic.",,['Indonesia'],archive.ph,https://www.facebook.com/Satria994/posts/4279602758731718?_rdc=1&_rdr,facebook.com,6/18/20,"['establishes', 'covid', 'pandemic', 'day', 'receiving', 'donations', 'gates']"
7185,6/18/20,Brazil,,,,Brazil,Agência Lupa,"CoronaVac, a vaccine that is being developed in China and will be tested in Brazil, is being funded by Bill Gates.",Facebook,https://www.facebook.com/OficialCanalOnOff/photos/a.209028656615968/694344394751056/?type=3&__xts__%5B0%5D=68.ARCOPf9b_HY00iTV2nlSgJO-le_jKvKKwQj5ON2VQT_8GWTK7ovBERKPbJ5VxqgP0jC5q5W-9DuezWzpCw2P3Yf-gLasv_kirx6yfmP-oa-Ndq15kipyyJdkX18qL0ij4bnkD7ZKj9AG6VxS_pWpdt5D1TLIbBIh_KJO4md0nHewQCQMTlUOcWXyyQeM93IX2VZFssJ34WGYGlEgMA1xKx8zRDZPFV4S3epiQ765RdyWCiumpgc0JFCxet_VmJp1T7hBVAXaqKQNth-L5bKTmC5blE5OHOQDdhyOrAFXoiFyffrh_1BPqdtG2T5NqiKSkkiz&__tn__=-R,https://piaui.folha.uol.com.br/lupa/2020/06/18/verificamos-vacina-gates-chinesa/,Portuguese,FALSE,"CoronaVac and INO-4800, the one being funded by Gates, are different vaccines, being developed by different companies in different countries, with different technologies.",conspiracy theory,['Brazil'],facebook.com,https://www.facebook.com/OficialCanalOnOff/photos/a.209028656615968/694344394751056/?type=3&__xts__%5B0%5D=68.ARCOPf9b_HY00iTV2nlSgJO-le_jKvKKwQj5ON2VQT_8GWTK7ovBERKPbJ5VxqgP0jC5q5W-9DuezWzpCw2P3Yf-gLasv_kirx6yfmP-oa-Ndq15kipyyJdkX18qL0ij4bnkD7ZKj9AG6VxS_pWpdt5D1TLIbBIh_KJO4md0nHewQCQMTlUOcWXyyQeM93IX2VZFssJ34WGYGlEgMA1xKx8zRDZPFV4S3epiQ765RdyWCiumpgc0JFCxet_VmJp1T7hBVAXaqKQNth-L5bKTmC5blE5OHOQDdhyOrAFXoiFyffrh_1BPqdtG2T5NqiKSkkiz&__tn__=-R,facebook.com,6/18/20,"['coronavac', 'vaccine', 'developed', 'china', 'tested', 'brazil', 'funded', 'gates']"
7474,6/19/20,Australia,New Zealand,,,"Australia, New Zealand",AAP FactCheck,"Bill Gates, who is supporting COVID-19 vaccine research, visited in New Zealand during May.",Facebook,https://www.facebook.com/photo.php?fbid=2745744775657252&set=a.1390752697823140&type=3&theater,https://www.aap.com.au/bill-gates-wasnt-in-new-zealand-this-year-and-those-microchip-claims-have-already-been-debunked/,English,FALSE,The Gates Foundation said Mr Gates has not been in New Zealand in 2020.,conspiracy theory,"['Australia', 'New Zealand']",facebook.com,https://www.facebook.com/photo.php?fbid=2745744775657252&set=a.1390752697823140&type=3&theater,facebook.com,6/19/20,"['gates', 'supporting', 'covid', 'vaccine', 'research', 'visited', 'new', 'zealand']"
7221,6/22/20,Argentina,,,,Argentina,Chequeado,"Bill Gates-funded vaccine got 1,200 girls sick in India.","Facebook, Website",https://chequeado.com/wp-content/uploads/2020/06/Posteo-verificado-El-Contramedio-1280x549.png,https://chequeado.com/el-explicador/es-falso-que-una-vacuna-financiada-por-bill-gates-enfermo-a-1200-ninas-en-india/,Spanish,FALSE,"There is no evidence to support this. No lawsuit is being held against the founder of Microsoft over this issue, as the viral Facebook post hints.",cures,['Argentina'],chequeado.com,https://chequeado.com/wp-content/uploads/2020/06/Posteo-verificado-El-Contramedio-1280x549.png,chequeado.com,6/22/20,"['gates', 'funded', 'vaccine', 'got', '200', 'girls', 'sick', 'india']"
7244,6/23/20,Spain,Argentina,,,Spain,EFE Verifica,"Bill Gates has said that the COVID-19 vaccine could kill 700,000 people.","Facebook, Twitter",https://www.facebook.com/234401220580489/posts/559441841409757,https://www.efe.com/efe/espana/efeverifica/bill-gates-no-dijo-que-la-vacuna-de-covid-19-podria-causar-700-000-muertes/50001435-4279266,Spanish,FALSE,"Gates is not referring to deaths, but to the number of people who could suffer some side effect if they were vaccinated against COVID-19.",,['Spain'],facebook.com,https://www.facebook.com/234401220580489/posts/559441841409757,facebook.com,6/23/20,"['gates', 'said', 'covid', 'vaccine', 'kill', '700', '000', 'people']"
7224,6/23/20,Spain,,,,Spain,Newtral.es,Bill Gates said that the COVID-19 vaccine will permanently change your DNA.,Social Media and Websites,Unavaliable,https://www.newtral.es/bill-gates-vacuna-coronavirus-adn/20200623/,Spanish,FALSE,The new RNA and DNA vaccine candidates are experimental  but in no way capable of modifying human genetic material. ,conspiracy theory,['Spain'],N/A,Unavaliable,N/A,6/23/20,"['gates', 'said', 'covid', 'vaccine', 'permanently', 'change', 'dna']"
