,date,country_1,country_2,country_3,country_4,countries,organization,claim,source,source_url,fact_check_url,fact_check_lang,final_rating,explanation,category,countries_list,source_domain,resolved_url,resolved_domain,datetime,claim_p
63,1/27/20,Croatia,,,,Croatia,Faktograf,BIll Gates contributed to the spread of coronavirus.,Facebook,https://www.facebook.com/MatrixWorldhr/posts/2902224963162032,https://faktograf.hr/?p=15933,Croatian,misleading,The work that Bill & Melinda Gates Foundation does on healthcare has in no way contributed to the spread of coronavirus.,conspiracy theory,['Croatia'],facebook.com,https://www.facebook.com/MatrixWorldhr/posts/2902224963162032,facebook.com,1/27/20,"['gates', 'contributed', 'spread', 'coronavirus']"
101,1/28/20,Canada,,,,Canada,Décrypteurs - Radio-Canada,Bill Gates predicted that the coronavirus pandemic would kill 65 million people and created a vaccine to eradicate Africans.,"Facebook, Website",https://www.facebook.com/www.RCANews236/posts/223289692413202,https://ici.radio-canada.ca/nouvelle/1689994/bill-gates-pandemie-coronavirus-covid19-event-201-didier-raoult-vaccin-afrique-faux,French,FALSE,The Bill Gates foundation funded a simulation which was not a prediction of the current pandemic and Bill Gates did not create a vaccine for coronavirus.,conspiracy theory,['Canada'],facebook.com,https://www.facebook.com/www.RCANews236/posts/223289692413202,facebook.com,1/28/20,"['gates', 'predicted', 'coronavirus', 'pandemic', 'kill', 'million', 'people', 'created', 'vaccine', 'eradicate', 'africans']"
120,1/28/20,United States,,,,United States,FactCheck.org,"“Bill and Melinda gates Foundation & others predicted up to 65 million deaths via coronavirus - in simulation ran 3 months ago""\",InfoWars,https://www.infowars.com/bill-and-melinda-gates-foundation-others-predicted-up-to-65-million-deaths-via-coronavirus-in-simulation-ran-3-months-ago/,https://www.factcheck.org/2020/01/new-coronavirus-wasnt-predicted-in-simulation/,English,FALSE,InfoWars distorted the facts about an emergency preparedness exercise for a fictional pandemic exercise.,conspiracy theory,['United States'],infowars.com,https://www.infowars.com/bill-and-melinda-gates-foundation-others-predicted-up-to-65-million-deaths-via-coronavirus-in-simulation-ran-3-months-ago/,infowars.com,1/28/20,"['melinda', 'gates', 'foundation', 'predicted', 'million', 'deaths', 'coronavirus', 'simulation', 'ran', 'months', 'ago']"
146,1/29/20,Spain,,,,Spain,Maldita.es,Bill Gates patented the coronavirus.,WhatsApp,Unavaliable,https://maldita.es/malditobulo/no-no-hay-pruebas-de-que-bill-gates-sea-el-propietario-de-la-patente-del-brote-del-nuevo-coronavirus-iniciado-en-china/,Spanish,no evidence,Please click the link to read the full article,conspiracy theory,['Spain'],N/A,Unavaliable,N/A,1/29/20,"['gates', 'patented', 'coronavirus']"
161,1/29/20,Lithuania,,,,Lithuania,15min.lt,"Coronavirus was made in a lab, with pre existing patents for a vaccine. The Bill and Melinda Gates foundation is involved in spreading the coronavirus.","Ugnius Kiguolis, local antivaxer, a businessman",https://www.facebook.com/photo.php?fbid=2527224704185279&set=a.1374802509427510&type=3,https://www.15min.lt/naujiena/aktualu/lietuva/samokslo-teorijos-apie-koronavirusa-jau-lietuvoje-jas-platina-u-kiguolis-56-1267990,Lithuanian,FALSE,Please click the link to read the full article,conspiracy theory,['Lithuania'],facebook.com,https://www.facebook.com/photo.php?fbid=2527224704185279&set=a.1374802509427510&type=3,facebook.com,1/29/20,"['coronavirus', 'lab', 'pre', 'existing', 'patents', 'vaccine', 'melinda', 'gates', 'foundation', 'involved', 'spreading', 'coronavirus']"
169,1/29/20,France,United States,,,"France, United States",Les Décodeurs,Bill Gates predicted and simulated the COVID-19 pandemic.,Wikistrike.com,http://www.wikistrike.com/2020/01/bill-gates-a-predit-le-coronavirus-chinois-il-y-a-un-an-avec-une-simulation-quasi-copiee-collee-predisant-la-mort-de-33-millions-de,https://www.lemonde.fr/les-decodeurs/article/2020/02/06/coronavirus-la-fondation-gates-a-t-elle-organise-une-simulation-de-l-epidemie-a-la-fin-de-2019_6028667_4355770.html,French,FALSE,Bill Gates' foundation worked on the possibility that a coronavirus could spread and be responsible of a pandemia. It can't be taken as a prediction because multiple coronavirus have been known for decades. It didn't foresee the current pandemia.,conspiracy theory,"['France', 'United States']",wikistrike.com,http://www.wikistrike.com/2020/01/bill-gates-a-predit-le-coronavirus-chinois-il-y-a-un-an-avec-une-simulation-quasi-copiee-collee-predisant-la-mort-de-33-millions-de,wikistrike.com,1/29/20,"['gates', 'predicted', 'simulated', 'covid', 'pandemic']"
181,1/30/20,Poland,,,,Poland,Demagog,Gates Foundation has funded the development of the new coronavirus.,Website,https://wolnemedia.net/koronawirus-z-wuhan-uzyskal-patent-w-2018-r/?fbclid=IwAR2m1ZyaKlwAAg2hP8xu2OEKrKR2LswRUyLrvCZfpHB2Ruhvit6h4sdt6D4,https://demagog.org.pl/analizy_i_raporty/nie-bill-gates-nie-sfinansowal-koronawirusa-z-wuhan/,Polish,FALSE,"The article was based on a false connection of facts concerning the Gates Foundation and the Pirbright Institute which resulted in a misleading context and, ultimately, in a disinformative article.",conspiracy theory,['Poland'],wolnemedia.net,https://wolnemedia.net/koronawirus-z-wuhan-uzyskal-patent-w-2018-r/?fbclid=IwAR2m1ZyaKlwAAg2hP8xu2OEKrKR2LswRUyLrvCZfpHB2Ruhvit6h4sdt6D4,wolnemedia.net,1/30/20,"['gates', 'foundation', 'funded', 'development', 'new', 'coronavirus']"
254,1/31/20,Spain,,,,Spain,Newtral.es,An institute funded by Bill Gates will contribute to 65 million deaths in the coronavirus outbreak.,Many social media platforms,Unavaliable,https://www.newtral.es/no-hay-pruebas-de-que-bill-gates-sea-el-propietario-de-la-patente-de-la-nueva-cepa-del-coronavirus/20200131/,Spanish,FALSE,The healthcare work by the Bill and Melinda Gates Foundation has not contributed to the spread of coronavirus.,conspiracy theory,['Spain'],N/A,Unavaliable,N/A,1/31/20,"['institute', 'funded', 'gates', 'contribute', 'million', 'deaths', 'coronavirus', 'outbreak']"
5583,1/31/20,Argentina,,,,Argentina,AFP,Bill Gates predicted the coronavirus outbreak.,Facebook,https://perma.cc/HUV9-M5N7,https://factual.afp.com/la-fundacion-de-bill-gates-participo-en-un-simulacro-de-pandemia-pero-con-sintomas-comunes-varias,Spanish,misleading,"The Bill Gates Foundation did particiapte in a pandemic drill, but it was based on another virus model and another epidemic from years ago.",,['Argentina'],perma.cc,https://www.facebook.com/siedmiomilowy/photos/a.2047184432175803/2734927576734815/?type=3&theater,facebook.com,1/31/20,"['gates', 'predicted', 'coronavirus', 'outbreak']"
5425,1/31/20,Argentina,,,,Argentina,AFP,Bill Gates predicted the coronavirus outbreak.,Facebook,https://perma.cc/HUV9-M5N7,https://factual.afp.com/la-fundacion-de-bill-gates-participo-en-un-simulacro-de-pandemia-pero-con-sintomas-comunes-varias,Spanish,FALSE,"The Bill Gates Foundation participated in a pandemic drill that is not associated with the coronavirus. It was based on a invented virus model that also coincide with epidemics from previous years, caused by other strains.",,['Argentina'],perma.cc,https://www.facebook.com/siedmiomilowy/photos/a.2047184432175803/2734927576734815/?type=3&theater,facebook.com,1/31/20,"['gates', 'predicted', 'coronavirus', 'outbreak']"
267,2/1/20,Turkey,,,,Turkey,Teyit,The Gates Foundation was the real agent behind the pandemic.,Journalist,https://dai.ly/x7r906q,https://teyit.org/koronavirus-salgininin-arkasinda-gates-vakfinin-oldugu-iddiasi/,Turkish,FALSE,A simulation the Gates Foundation funded was based on another coronavirus in the same family.,conspiracy theory,['Turkey'],dai.ly,https://dai.ly/x7r906q,dai.ly,2/1/20,"['gates', 'foundation', 'real', 'agent', 'pandemic']"
289,2/2/20,Lithuania,,,,Lithuania,15min.lt,"The coronavirus outbreak is the start of a depopulation program, based on links established by the Bill and Melinda Gates Foundation.",Minfo.lt and facebook users,https://minfo.lt/pasaulis/straipsnis/koronaviruso-protrukis-kinijoje-prasidejo-depopuliacijos-programa?fbclid=IwAR266IA-I0MvuNv_vThCdLFQ9DsZe09X5wUglvvf68RtRfitq0yczzgTmz0,https://www.15min.lt/naujiena/aktualu/lietuva/samoksla-del-uhano-koronaviruso-tresia-melu-ir-prastu-duomenu-supratimu-56-1270922,Lithuanian,FALSE,Please click the link to read the full article,conspiracy theory,['Lithuania'],minfo.lt,https://minfo.lt/pasaulis/straipsnis/koronaviruso-protrukis-kinijoje-prasidejo-depopuliacijos-programa?fbclid=IwAR266IA-I0MvuNv_vThCdLFQ9DsZe09X5wUglvvf68RtRfitq0yczzgTmz0,minfo.lt,2/2/20,"['coronavirus', 'outbreak', 'start', 'depopulation', 'program', 'based', 'links', 'established', 'melinda', 'gates', 'foundation']"
307,2/3/20,United States,,,,United States,LeadStories,Bill Gates helped fund a patent for coronavirus.,Website,https://www.naturalnews.com/2020-01-29-bill-gates-pandemic-exercise-coronavirus.html?fbclid=IwAR2AutzfuBHjQHgdDAfxlHjpOy57_ne7eea7qjzmIjRTCX0pHhwosGFW6jI,https://hoax-alert.leadstories.com/3471583-fake-news-bill-gates-did-not-help-fund-patent-for-coronavirus.html,English,FALSE,"The Pirbright Institute said the patents involve infectious bronchitis virus only, and the Gates Foundation did not fund that work.",conspiracy theory,['United States'],naturalnews.com,https://www.naturalnews.com/2020-01-29-bill-gates-pandemic-exercise-coronavirus.html?fbclid=IwAR2AutzfuBHjQHgdDAfxlHjpOy57_ne7eea7qjzmIjRTCX0pHhwosGFW6jI,naturalnews.com,2/3/20,"['gates', 'helped', 'fund', 'patent', 'coronavirus']"
488,2/10/20,Italy,,,,Italy,Pagella Politica,Bill Gates predicted coronavirus.,Facebook,https://www.facebook.com/photo.php?fbid=2536809369761305&set=a.110770439031889&type=3&theater,https://pagellapolitica.it/bufale/show/932/no-bill-gates-non-ha-predetto-il-nuovo-coronavirus,Italian,FALSE,Bill Gates did not predict the new coronavirus.,conspiracy theory,['Italy'],facebook.com,https://www.facebook.com/photo.php?fbid=2536809369761305&set=a.110770439031889&type=3&theater,facebook.com,2/10/20,"['gates', 'predicted', 'coronavirus']"
685,2/23/20,United States,,,,United States,LeadStories,Bill Gates wrote a letter saying COVID-19 is teaching humans a lesson.,https://www.thesun.co.uk/news/,http://archive.is/WLJg4,https://leadstories.com/hoax-alert/2020/03/Fact-Check-Bill-Gates-did-NOT-write-an-open-letter-saying-COVID-10-reminds-we-are-all-equal.html,English,FALSE,The story was retracted and the letter was fake.,conspiracy theory,['United States'],archive.is,https://www.thesun.co.uk/news/11238171/bill-gates-coronavirus-letter-reminds-us-we-are-all-equal/,thesun.co.uk,2/23/20,"['gates', 'wrote', 'letter', 'saying', 'covid', 'teaching', 'humans', 'lesson']"
5720,3/1/20,France,,,,France,AFP,Bill Gates is working on an electronic chip to implant under human skin in order to locate and control people.,social media,https://perma.cc/LH2J-XNBE,https://factuel.afp.com/non-bill-gates-na-pas-propose-dimplanter-une-puce-electronique-la-population,French,FALSE,"This is a common conspiracy theory, but Bill Gates never claimed working on this kind of project.",conspiracy theory,['France'],perma.cc,https://au-dela-du-climat.org/2020/04/27/vaccination-et-injection-de-passeport-sante-sous-la-peau-lafrique-et-la-france-en-danger-imminent-bill-gates-loms-et-la-france-sassocient/?fbclid=IwAR04gudhs9xpHXhGNZN-nBCtuciRV-_IPRuGor81BMkG7l97wwlrkq6G8Sc,au-dela-du-climat.org,3/1/20,"['gates', 'working', 'electronic', 'chip', 'implant', 'human', 'skin', 'order', 'locate', 'control', 'people']"
1997,3/20/20,United States,,,,United States,LeadStories,Bill Gates has access to your DNA and ownership in WHO.,Facebook,https://www.facebook.com/photo.php?fbid=2863853827013734&set=a.391605377571937&type=3,https://leadstories.com/hoax-alert/2020/03/Fact-Check-Bill-Gates-Does-NOT-Have-Access-To-Your-DNA-And-Does-NOT-Have-Ownership-In-WHO.html,English,FALSE,Gates is not behind testing because each country does that themselves.,conspiracy theory,['United States'],facebook.com,https://www.facebook.com/photo.php?fbid=2863853827013734&set=a.391605377571937&type=3,facebook.com,3/20/20,"['gates', 'access', 'dna', 'ownership']"
2085,3/21/20,United States,,,,United States,LeadStories,Bill Gates and the Vatican have a plan to depopulate the world with a coronavirus vaccine.,Saving Health Ministries,https://www.youtube.com/watch?v=Yyxv7pKWeKQ,https://hoax-alert.leadstories.com/3472026-fact-check-no-plan-by-bill-gates-and-the-vatican-to-depopulate-world-with-coronavirus-vaccine-video-misinterprets-gates-speech.html,English,FALSE,Video clip is taken out of context from a 2010 Gates TedTalk.,conspiracy theory,['United States'],youtube.com,https://www.youtube.com/watch?v=Yyxv7pKWeKQ,youtube.com,3/21/20,"['gates', 'vatican', 'plan', 'depopulate', 'world', 'coronavirus', 'vaccine']"
2491,3/25/20,Hong Kong,,,,Hong Kong,AFP,"An ""open letter” purportedly written by US billionaire and philanthropist Bill Gates about the novel coronavirus pandemic has been shared in English and Chinese on Facebook, Twitter and various websites. The Chinese-language posts state the letter was translated from its original publication in British newspaper The Sun.",Facebook,https://perma.cc/Y46V-2V5Y,https://factcheck.afp.com/gates-foundation-urges-netizens-stop-sharing-fake-bill-gates-coronavirus-letter,English,FALSE,"The letter is fake. Gates’ philanthropic organization, the Bill and Melinda Gates Foundation, clarified on Weibo that the letter presents “false information” and urged netizens to stop sharing it. The Sun has reportedly removed the letter from its website.",other,['Hong Kong'],perma.cc,https://www.facebook.com/permalink.php?story_fbid=3286871851327821&id=100000151150259,facebook.com,3/25/20,"['open', 'letter', 'purportedly', 'written', 'billionaire', 'philanthropist', 'gates', 'novel', 'coronavirus', 'pandemic', 'shared', 'english', 'chinese', 'facebook', 'twitter', 'websites', 'chinese', 'language', 'posts', 'state', 'letter', 'translated', 'original', 'publication', 'british', 'newspaper', 'sun']"
2533,3/25/20,Taiwan,,,,Taiwan,Taiwan FactCheck Center,An open letter from Bill Gates: The Microsoft founder believes there is a spiritual purpose behind the disease.,"Line, Facebook",https://www.thesun.ie/legal-removal/5239648/bill-gates-says-coronavirus-reminds-us-we-are-all-equal-in-powerful-message/,https://tfc-taiwan.org.tw/articles/3383,Chinese (traditional),FALSE,"
The Bill and Melinda Gates Foundation has denied publishing that letter. The Sun, which ran a story about the Gates letter, removed the story and apologized for the incident.",conspiracy theory,['Taiwan'],thesun.ie,https://www.thesun.ie/legal-removal/5239648/bill-gates-says-coronavirus-reminds-us-we-are-all-equal-in-powerful-message/,thesun.ie,3/25/20,"['open', 'letter', 'gates', 'microsoft', 'founder', 'believes', 'spiritual', 'purpose', 'disease']"
2624,3/26/20,Spain,,,,Spain,Maldita.es,A letter supposedly written by Bill Gates where he says that the coronavirus is the corrector of humanity.,Many social media platforms,https://maldita.es/buloteca/contenido-buloteca/supuestamente-de-bill-gates,https://maldita.es/malditobulo/2020/03/27/bill-gates-carta-coronavirus-gran-corrector/,Spanish,FALSE,"In the letter, supposedly written by Bill Gates, he says the coronavirus has a ""spiritual purpose"", that it is ""the great corrector"" and that ""it is here to teach us some lessons that it seems we have forgotten."" There is no evidence that Bill Gates is the author of this letter; he has not said anything similar in the latest public statements and the people who claim this provide no evidence of it.",conspiracy theory,['Spain'],maldita.es,https://maldita.es/buloteca/contenido-buloteca/supuestamente-de-bill-gates,maldita.es,3/26/20,"['letter', 'supposedly', 'written', 'gates', 'says', 'coronavirus', 'corrector', 'humanity']"
2706,3/27/20,Venezuela,United States,Spain,Italy,"Venezuela, United States, Spain, Italy",Efecto Cocuyo,"Venezuelan YouTuber Ruby Demestoy talked about Event 201, Bill Gates and VIH and SARS conspiracies.",Ruby Demestoy,https://www.youtube.com/watch?v=Oa-b4_aYOxA,https://efectococuyo.com/cocuyo-chequea/ruby-demestoy-datoscoronavirus/,Spanish,FALSE,Well-known conspiracies and many others lack precise scientific information.,conspiracy theory,"['Venezuela', 'United States', 'Spain', 'Italy']",youtube.com,https://www.youtube.com/watch?v=Oa-b4_aYOxA,youtube.com,3/27/20,"['venezuelan', 'youtuber', 'ruby', 'demestoy', 'talked', 'event', '201', 'gates', 'vih', 'sars', 'conspiracies']"
2720,3/27/20,Senegal,Ivory Coast,Cameroon,Congo,"Senegal, Ivory Coast, Cameroon, Congo",AFP,"French professor Didier Raoult, director of IHU Marseille, told Africans not to take ""Bill Gates' vaccine"" against coronavirus because it is ""poisonous.""",Facebook,https://perma.cc/9JBP-DTJ9,https://factuel.afp.com/non-didier-raoult-na-pas-incite-les-africains-ne-pas-prendre-un-vaccin-contre-le-coronavirus,French,FALSE,"The IHU Marseille has denied that its director made such comments, and there is currently no vaccine or approved treatment. If scientific research is underway, no vaccine should be released until at least next year.",authorities,"['Senegal', 'Ivory Coast', 'Cameroon', 'Congo']",perma.cc,https://www.facebook.com/photo.php?fbid=1543730949112079&set=a.106776382807550&type=3&theater,facebook.com,3/27/20,"['french', 'professor', 'didier', 'raoult', 'director', 'ihu', 'marseille', 'told', 'africans', 'gates', 'vaccine', 'coronavirus', 'poisonous']"
3008,3/30/20,France,,,,France,CheckNews,French champion of chloroquine Didier Raoult is supposed to have said not to use Bill Gates' vaccines.,Facebook,https://www.facebook.com/photo.php?fbid=3543606912381022&set=a.138702276204853&type=3,https://www.liberation.fr/checknews/2020/03/30/non-didier-raoult-n-a-pas-appele-les-africains-a-ne-pas-prendre-le-vaccin-de-bill-gates-contre-le-co_1783559,French,FALSE,Raoult's team denies he made such a statement.,conspiracy theory,['France'],facebook.com,https://www.facebook.com/photo.php?fbid=3543606912381022&set=a.138702276204853&type=3,facebook.com,3/30/20,"['french', 'champion', 'chloroquine', 'didier', 'raoult', 'supposed', 'said', 'use', 'gates', 'vaccines']"
3050,3/31/20,East Africa,Africa,France,,"East Africa, Africa, France",AFP,"A post shared hundreds of times on Facebook claims that Didier Raoult, a French specialist in infectious diseases, is urging Africans “not to take Bill Gates vaccine” against coronavirus as it contains “poison”.",Facebook,https://perma.cc/LK76-V7B5,https://factcheck.afp.com/french-doctor-did-not-urge-africans-avoid-bill-gates-vaccine,English,FALSE,"This is false. The institute which Raoult directs denied he ever made these claims. Moreover, no vaccine exists against coronavirus.",conspiracy theory,"['East Africa', 'Africa', 'France']",perma.cc,https://www.facebook.com/photo.php?fbid=10157546470462203&set=a.123090557202&type=3&theater,facebook.com,3/31/20,"['post', 'shared', 'hundreds', 'times', 'facebook', 'claims', 'didier', 'raoult', 'french', 'specialist', 'infectious', 'diseases', 'urging', 'africans', 'gates', 'vaccine', 'coronavirus', 'contains', 'poison']"
3188,4/1/20,India,,,,India,India Today,Bill Gates wrote a letter that says coronavirus has a “spiritual purpose” and is “a great corrector”.,Facebook,https://www.facebook.com/groups/570966543394233/permalink/831062557384629/,https://www.indiatoday.in/fact-check/story/did-bill-gates-coronavirus-great-corrector-truth-covid19-1662280-2020-04-01,English,FALSE,The viral letter is a hoax and has been falsely attributed to Bill Gates.,conspiracy theory,['India'],facebook.com,https://www.facebook.com/groups/570966543394233/permalink/831062557384629/,facebook.com,4/1/20,"['gates', 'wrote', 'letter', 'says', 'coronavirus', 'spiritual', 'purpose', 'great', 'corrector']"
3416,4/3/20,Senegal,West Africa,,,"Senegal, West Africa",AFP,"A video shows a meeting between American billionnaire Bill Gates and Senegalese president Macky Sall, who agreed to test COVID-19 vaccines in Senegal.",Social media,https://perma.cc/7X2R-E2A5,https://factuel.afp.com/ces-images-dune-rencontre-entre-le-president-senegalais-macky-sall-et-bill-gates-datent-de-2016,French,FALSE,"These images were shot in 2016 during an international Summit in Montreal. To this day, there is still no vaccine against COVID-19. ",,"['Senegal', 'West Africa']",perma.cc,https://www.facebook.com/deltchapo/videos/354311008822930/,facebook.com,4/3/20,"['video', 'shows', 'meeting', 'american', 'billionnaire', 'gates', 'senegalese', 'president', 'macky', 'sall', 'agreed', 'test', 'covid', 'vaccines', 'senegal']"
3418,4/3/20,United States,,,,United States,LeadStories,"Big Pharma, Dr. Anthony Fauci and Bill Gates want to ban hydroxychoroquine.",drcarolehaynes.com,http://drcarolehhaynes.com/index.php/articles/government/364-why-big-pharma-fauci-and-bill-gates-want-to-ban-hydroxychloroquine?fbclid=IwAR0qAL40ZUtDgMVBKwV3FuwOc4SfLLkXluG3aa8i5pbiQO53H6xJAfg9KP4,https://leadstories.com/hoax-alert/2020/04/Fact-Check-No-Deep-State-Operators-Trying-To-Ban-Hydroxychloroquine.html,English,FALSE,The federal government is actually conducting clinial for hydroxychloroquine as a potential treatment for coronavirus.,cures,['United States'],drcarolehhaynes.com,http://drcarolehhaynes.com/index.php/articles/government/364-why-big-pharma-fauci-and-bill-gates-want-to-ban-hydroxychloroquine?fbclid=IwAR0qAL40ZUtDgMVBKwV3FuwOc4SfLLkXluG3aa8i5pbiQO53H6xJAfg9KP4,drcarolehhaynes.com,4/3/20,"['big', 'pharma', 'anthony', 'fauci', 'gates', 'want', 'ban', 'hydroxychoroquine']"
3629,4/6/20,Latvia,,,,Latvia,Re:Check,Claim saying Bill Gates has said microchips will be mandatory for travelling after COVID-19.,Facebook ,https://www.facebook.com/photo.php?fbid=3078351692214977&set=a.465707913479381&type=3&theater,https://rebaltica.lv/2020/04/nav-taisniba-bils-geits-nav-runajis-par-obligatiem-mikrocipiem-celosanai/,Latvian,FALSE,"Conspiracy theories on vaccination and ""total control"" are built around things Bill Gates never actually said.",conspiracy theory,['Latvia'],facebook.com,https://www.facebook.com/photo.php?fbid=3078351692214977&set=a.465707913479381&type=3&theater,facebook.com,4/6/20,"['claim', 'saying', 'gates', 'said', 'microchips', 'mandatory', 'travelling', 'covid']"
3799,4/8/20,Nigeria,,,,Nigeria,Dubawa,"A Facebook user claims Melinda Gates divorced her husband, Bill Gates, for wanting to destroy Africa.",Facebook,https://web.facebook.com/godwin.ajames.1/posts/523818331896144,https://dubawa.org/trained-shot-against-the-gates-family-misses-again/,English,FALSE,"During an interview with Poppy Harlow on CNN, Melinda Gates discussed her Foundation’s plans to tackle the pandemic. She further advised African leaders to act fast, as their countries will arguably be the worst hit. At no point, however, did she discuss her marital affairs; nor proclaim her husband a killer or someone with a murderous mind. Most importantly, any information of this magnitude about the world’s richest couple would hit the headlines of major news platforms; not just social media outlets, least of all from users with no credibility or track record. ",conspiracy theory,['Nigeria'],facebook.com,https://web.facebook.com/godwin.ajames.1/posts/523818331896144,facebook.com,4/8/20,"['facebook', 'user', 'claims', 'melinda', 'gates', 'divorced', 'husband', 'gates', 'wanting', 'destroy', 'africa']"
3808,4/8/20,United States,India,,,"United States, India",LeadStories,"India is suing Microsoft founder Bill Gates because of his vaccine against coronavirus that killed 77,000 girls. ",facebook,https://www.facebook.com/photo.php?fbid=10221366988420303&set=a.1074567380532&type=3,https://leadstories.com/hoax-alert/2020/04/fact-check-india-is-not-suing-bill-gates-for-vaccination-deaths.html,English,FALSE,"The actual photo is not recent, but one taken in 2018 during a workshop between the NIH and the Bill and Melinda Gates Foundation. And only seven girls died after participating in an HPV vaccine trial, though their deaths were also unrelated to the drug. It's not related to coronavirus.",cures,"['United States', 'India']",facebook.com,https://www.facebook.com/photo.php?fbid=10221366988420303&set=a.1074567380532&type=3,facebook.com,4/8/20,"['india', 'suing', 'microsoft', 'founder', 'gates', 'vaccine', 'coronavirus', 'killed', '000', 'girls']"
5936,4/9/20,United States,,,,United States,LeadStories,Bill Gates personally will profit from a COVID-19 vaccine and he owns a company that plans to implant microchips in everyone.,facebook,https://www.facebook.com/photo.php?fbid=10156746294881783&set=a.10150249896251783&type=3,https://leadstories.com/hoax-alert/2020/05/fact-check-gates-will-not-profit-from-a-covid-19-vaccine.html,English,FALSE,"Bill Gates and his wife, Melinda Gates, have pledged to give almost all of their estimated $106 billion wealth to charity. ID2020, the entity that allegedly has a microchip plan for the world's population, does not have a microchip plan and is not owned by Gates.",conspiracy theory,['United States'],facebook.com,https://www.facebook.com/photo.php?fbid=10156746294881783&set=a.10150249896251783&type=3,facebook.com,4/9/20,"['gates', 'personally', 'profit', 'covid', 'vaccine', 'owns', 'company', 'plans', 'implant', 'microchips']"
