,date,country_1,country_2,country_3,country_4,countries,organization,claim,source,source_url,fact_check_url,fact_check_lang,final_rating,explanation,category,countries_list,source_domain,resolved_url,resolved_domain,datetime,claim_p
6110,4/30/20,United States,,,,United States,PolitiFact,“Bill Gates admits his COVID-19 vaccine might kill nearly 1 million people.”,Facebook posts,https://archive.fo/L6rto,https://www.politifact.com/factchecks/2020/may/19/facebook-posts/bill-gates-did-not-say-covid-19-vaccine-could-kill/,English,FALSE,"The Gates Foundation is trying to develop a coronavirus vaccine. Gates spoke theoretically about how many people might suffer side effects from a vaccine, not about how many might die from it.",cures,['United States'],archive.fo,https://cloverchronicle.com/2020/04/30/watch-bill-gates-admits-his-covid-19-vaccine-might-kill-nearly-1000000-people/?fbclid=IwAR0RSlAhYBCU_04eqWpeHNCqZWO7tHmLg6_jm-NOXzO0ZAiu_I5u2WeoQjI,cloverchronicle.com,4/30/20,"['gates', 'admits', 'covid', 'vaccine', 'kill', 'nearly', 'million', 'people']"
4934,4/30/20,Portugal,,,,Portugal,Poligrafo,"Hydroxychloroquine ""cures COVID-19"" but there is a conspiracy by Biil Gates and Dr. Fauci to ban it.", A website,https://www.oevento.pt/2020/04/23/hidroxicloroquina/?fbclid=IwAR2y50kHUfbeoBbkciJIZcxQYi8slhCtOHk2aziODdAxi06PtSWrSnLzfoM,https://poligrafo.sapo.pt/fact-check/a-hidroxicloroquina-cura-a-covid-19-mas-ha-uma-conspiracao-de-gates-e-fauci-para-a-proibir,Portuguese,FALSE,"There is no evidence that Bill Gates and Anthony Fauci are conspiring in order to ""hide"" hydroxycloroquine.",conspiracy theory,['Portugal'],oevento.pt,https://www.oevento.pt/2020/04/23/hidroxicloroquina/?fbclid=IwAR2y50kHUfbeoBbkciJIZcxQYi8slhCtOHk2aziODdAxi06PtSWrSnLzfoM,oevento.pt,4/30/20,"['hydroxychloroquine', 'cures', 'covid', 'conspiracy', 'biil', 'gates', 'fauci', 'ban']"
5385,4/30/20,Mali,,,,Mali,PesaCheck,Melinda Gates divorced her husband Bill because he created a toxic vaccine whose purpose is to destroy the African.,Facebook,http://archive.vn/mxrbN,https://pesacheck.org/faux-melinda-gates-na-pas-divorc%C3%A9-d-avec-bill-%C3%A0-cause-d-un-vaccin-ciblant-les-africains-pour-les-423734ab3e7b,English,FALSE,The Gates couple has not divorced and continues to support health personnel and the scientific community.,conspiracy theory,['Mali'],archive.vn,https://www.facebook.com/CIASPROD112/photos/a.2323648297742683/2899155150191992/?type=3&theater,facebook.com,4/30/20,"['melinda', 'gates', 'divorced', 'husband', 'created', 'toxic', 'vaccine', 'purpose', 'destroy', 'african']"
6346,5/1/20,Mexico,,,,Mexico,Animal Político,"An image claimed that the Bill Gates vaccination program ""deformed and ruined the lives of people in Africa.""",Facebook,https://m.facebook.com/story.php?story_fbid=927220001064212&id=100013286612681&sfnsn=scwspmo&extid=wjdx0W2khl4A2vvN,https://www.animalpolitico.com/elsabueso/ninos-vacunados-bill-gates/,Spanish,misleading,"The photograph of 3 children in blue t-shirts and blue shorts using crutches does not show any consequences of vaccination. On the contrary, the children in the photograph contracted polio, a disease that can be prevented by immunization.",authorities,['Mexico'],facebook.com,https://m.facebook.com/story.php?story_fbid=927220001064212&id=100013286612681&sfnsn=scwspmo&extid=wjdx0W2khl4A2vvN,facebook.com,5/1/20,"['image', 'claimed', 'gates', 'vaccination', 'program', 'deformed', 'ruined', 'lives', 'people', 'africa']"
5228,5/1/20,United States,,,,United States,AFP,Social media users have shared a photo that claims to show a “Center for Global Human Population Reduction” affiliated with the Bill & Melinda Gates Foundation.,"FB, Twitter",https://perma.cc/2KC5-XFXW,https://factcheck.afp.com/doctored-photo-latest-attack-bill-gates-amid-covid-19-vaccine-push,English,FALSE,"The image, however, has been manipulated. The stone signage it captures is the foundation’s Discovery Center in Seattle, which is not home to a depopulation effort, nor are the Microsoft co-founder and his wife behind any such initiative.",conspiracy theory,['United States'],perma.cc,https://www.facebook.com/groups/TrumpPenceAgainIn2020/permalink/964712963931889/,facebook.com,5/1/20,"['social', 'media', 'users', 'shared', 'photo', 'claims', 'center', 'global', 'human', 'population', 'reduction', 'affiliated', 'melinda', 'gates', 'foundation']"
5368,5/2/20,Nigeria,,,,Nigeria,AfricaCheck,"The Bill and Melinda Gates Foundation headquarters is called the ""Centre for Global Human Population Reduction"". ",Facebook,https://www.facebook.com/photo.php?fbid=160319155475589&set=a.100426094798229&type=3&theater,https://africacheck.org/fbcheck/centre-for-global-population-reduction-no-gates-foundation-entrance-sign-photoshopped/,English,FALSE,"The photo of the sign on the Gates Foundation headquarters has been photoshopped. The entrance only displays the words ""Bill and Melinda Gates Foundation"". ",other,['Nigeria'],facebook.com,https://www.facebook.com/photo.php?fbid=160319155475589&set=a.100426094798229&type=3&theater,facebook.com,5/2/20,"['melinda', 'gates', 'foundation', 'headquarters', 'called', 'centre', 'global', 'human', 'population', 'reduction']"
5570,5/4/20,Italy,,,,Italy,Facta,"A Whatsapp message which claims that the Italian government sent ""Nas"" (a branch of the Carabinieri) to close the department in charge of plamsa-related therapies at Mantua hospital, where ""they cure COVID-19 in 48 hours"". The government would have done that in order to obtain ""Bill Gates' vaccine"".",Facebook,https://www.facebook.com/photo.php?fbid=3021931074509836&set=a.972141792822118&type=3,https://facta.news/notizia-falsa/2020/05/11/no-il-governo-non-ha-mandato-i-nas-a-mantova-per-far-chiudere-il-reparto-di-terapia-al-plasma/,Italian,FALSE,"The news is fake. Mantua hospital has declared that the Nas have actually called and asked for general information about the plasma therapy against COVID-19, but they didn't do anything to try and stop the trials. The link between Bill Gates, the Italian government and a potential vaccine for coronavirus is also unfounded.",authorities,['Italy'],facebook.com,https://www.facebook.com/photo.php?fbid=3021931074509836&set=a.972141792822118&type=3,facebook.com,5/4/20,"['whatsapp', 'message', 'claims', 'italian', 'government', 'sent', 'nas', 'branch', 'carabinieri', 'close', 'department', 'charge', 'plamsa', 'related', 'therapies', 'mantua', 'hospital', 'cure', 'covid', 'hours', 'government', 'order', 'obtain', 'gates', 'vaccine']"
5652,5/4/20,Germany,,,,Germany,Correctiv,"In a video, blogger Ken Jebsen claims Bill Gates took control over the health system to force his vaccines upon everyone. He funds 80 percent of the WHO. In Germany people are arrested because they carry the constitution (Grundgesetz). Germany secretly wants to impose compulsory vaccines in a new law, and COVID-19 is just a harmless flu",Youtube,Unavaliable,https://correctiv.org/faktencheck/2020/05/08/grosse-verschwoerung-zum-coronavirus-wie-ken-jebsen-mit-falschen-behauptungen-stimmung-macht,German,partly false,"Parts of the claims in the video are conspiracy theories and can't be fact-checked. Contributions by the Bill Gates Foundation are only 11,41 percent of the WHO budget. The police in Berlin arrested people because their demonstration was not allowed. Mandatory vaccinations are not party of the law that the government wants to pass, and COVID-19 cannot be compared to the flu. ",authorities,['Germany'],N/A,Unavaliable,N/A,5/4/20,"['video', 'blogger', 'ken', 'jebsen', 'claims', 'gates', 'took', 'control', 'health', 'force', 'vaccines', 'funds', 'percent', 'germany', 'people', 'arrested', 'carry', 'constitution', 'grundgesetz', 'germany', 'secretly', 'wants', 'impose', 'compulsory', 'vaccines', 'new', 'law', 'covid', 'harmless', 'flu']"
5705,5/4/20,United States,,,,United States,AFP,"A post shared more than 160,000 times on Facebook during the novel coronavirus pandemic says Bill Gates wants “digital tattoos” to check who has been tested, and asks if it would be “like holocaust victims have.”",FB,https://perma.cc/E3UG-4868,https://factcheck.afp.com/holocaust-comparison-misleading-facebook-post-claims-bill-gates-seeks-digital-tattoos,English,FALSE,"Gates has spoken of the need for “digital certificates” for vaccination and testing but there is no evidence he has been in favor of a visible mark, like a tattoo. The Bill & Melinda Gates Foundation also said the claim is false.",other,['United States'],perma.cc,https://www.facebook.com/tom.ray.756/posts/10158207006949561,facebook.com,5/4/20,"['post', 'shared', '160', '000', 'times', 'facebook', 'novel', 'coronavirus', 'pandemic', 'says', 'gates', 'wants', 'digital', 'tattoos', 'check', 'tested', 'asks', 'like', 'holocaust', 'victims']"
5627,5/4/20,Croatia,,,,Croatia,Faktograf,Bill Gates claims and announces that vaccinations will be mandatory for all.,Facebook,https://archive.li/dPpeA,https://faktograf.hr/2020/05/04/ne-bill-gates-ne-moze-proglasiti-obvezno-cijepljenje-protiv-covida-19/,Croatian,FALSE,"Bill Gates has made various claims about vaccinations, the one quoted is a mash-up of many of those statments. Gates also doesn't have the authority to proclaim vaccinations mandatory.",,['Croatia'],archive.li,https://www.cikpogodi.info/338/ipak-potvrdeno-oglasio-se-bil-gejts-svi-ce-morati-da-se-vakcinisu-protiv-covid-19/?fbclid=IwAR0pRauo-QLeYuqmvjkvgq_VGb95Ez6U7kvYpA2O-E60QqjhaW376geHnCo,cikpogodi.info,5/4/20,"['gates', 'claims', 'announces', 'vaccinations', 'mandatory']"
5640,5/5/20,Mexico,Argentina,,,"Mexico, Argentina",Animal Político,Bill Gates uses COVID-19 to implement the ID2020 chip and monitor the world.,YouTube,https://www.youtube.com/watch?v=RKt2QDp5SZo,https://www.animalpolitico.com/elsabueso/bill-gates-covid-19-chip-id2020-vigilar-mundo-falso/,Spanish,FALSE,"The novel coronavirus was not intentionally created, the ID: 2020 alliance is not a project to inject microchips in the form of vaccines, and not all projects seeking a vaccine are funded by Bill Gates.",conspiracy theory,"['Mexico', 'Argentina']",youtube.com,https://www.youtube.com/watch?v=RKt2QDp5SZo,youtube.com,5/5/20,"['gates', 'uses', 'covid', 'implement', 'id2020', 'chip', 'monitor', 'world']"
5497,5/5/20,Italy,,,,Italy,Open,"Mantova hospital, in Italy, tests plasma treatment to heal COVID-19 patients. The Italian government has sent the Carabinieri to stop the experimentation. It's because of Bill Gates.",Media and Social,Unavaliable,https://www.open.online/2020/05/05/coronavirus-il-governo-manda-i-nas-a-mantova-per-chiudere-il-reparto-che-cura-i-pazienti-con-il-plasma-no,Italian,FALSE,The Carabinieri only made a phone call. They have never been to the Mantova hospital and have not stopped the trial.,conspiracy theory,['Italy'],N/A,Unavaliable,N/A,5/5/20,"['mantova', 'hospital', 'italy', 'tests', 'plasma', 'treatment', 'heal', 'covid', 'patients', 'italian', 'government', 'sent', 'carabinieri', 'stop', 'experimentation', 'gates']"
5924,5/5/20,United States,,,,United States,LeadStories,Bill Gates said that the Catholic religion may have to be suspended forever because of the COVID-19 pandemic.,fromrome.info,https://fromrome.info/2020/04/05/bill-gates-my-corona-stunt-requires-18-months-of-control-then-mandatory-vaccination/,https://leadstories.com/hoax-alert/2020/05/fact-check-bill-gates-did-not-say-catholic-religion-may-be-suspended-forever.html,English,FALSE,"Gates was talking in an interview about reducing attendance at unnecessary gatherings in general, not just in Catholicism.",other,['United States'],fromrome.info,https://fromrome.info/2020/04/05/bill-gates-my-corona-stunt-requires-18-months-of-control-then-mandatory-vaccination/,fromrome.info,5/5/20,"['gates', 'said', 'catholic', 'religion', 'suspended', 'forever', 'covid', 'pandemic']"
5921,5/6/20,United States,,,,United States,LeadStories,Viral video reveals there is a coronavirus vaccine patent owned by Bill Gates.,youtube,Unavaliable,https://leadstories.com/hoax-alert/2020/05/fact-check-dr-rashid-buttar-does-not-reveals-coronavirus-was-patented-by-bill-gates-in-2006.html,English,FALSE,"The patent listed in the video does not exist, and a similar patent number does not show a link tio a vaccine for COVID-9.",cures,['United States'],N/A,Unavaliable,N/A,5/6/20,"['viral', 'video', 'reveals', 'coronavirus', 'vaccine', 'patent', 'owned', 'gates']"
5836,5/6/20,United States,,,,United States,PolitiFact,Gates Foundation stands to make nearly £31.5 billion on a coronavirus vaccine in U.K.,Facebook posts,https://archive.fo/qD03l,https://www.politifact.com/factchecks/2020/may/14/facebook-posts/no-evidence-gates-foundation-will-profit-coronavir/,English,FALSE,"The £31.5 billion figure was calculated by multiplying an estimated cost per vaccine times the population of the United Kingdom. The estimated vaccine cost comes from a Daily Mail story, but we could find no other evidence to back it up. The Gates Foundation has pledged millions of dollars to companies developing potential coronavirus vaccines. There is no evidence that the charity stands to profit from them. The source of the Facebook post is a website that has published false conspiracy theories in the past.",other,['United States'],archive.fo,https://www.facebook.com/ReviveNaturalHealth/photos/a.1773422256250474/2629152907344067/?type=3&__xts__[0]=68.ARD4_XwVTInlbO9Ws9db0Nh_91fdhKXydGMV4wwdrgdmxwuL3yPivMbYZs2km0To4woTSrYgWFnW9pNfVTMMvN2NFun4nJ-tJ5Mw1MAUhdvHeTK4rPyLyS7viaXMJjYou7IwXvNOwIRQ43oWtt245hUc6pEFL4_KaiPV-MgqtrBvk4kuJ01Y8A_Fo_zd65K8QgsuYj5RbzwCvF4UTmSd_zOTVKahGb1rRgSfajAz80U1pYH8fL-vbVJD_wL-9O_f1tj5d5GlWxsOL4kk650P8i-Ip7wovEwxiaJxmNABzlM8C3723bPIzZSADHY9l0E9b7vKCHPQ,facebook.com,5/6/20,"['gates', 'foundation', 'stands', 'nearly', 'billion', 'coronavirus', 'vaccine']"
5180,5/6/20,Italy,,,,Italy,Facta,A video where Bill Gates is alledgely stating that vaccines are useful to sterilize and reduce the world population.,"Whatsapp, Youtube",https://www.youtube.com/watch?v=AiDRImVVIlY&feature=youtu.be,https://facta.news/notizia-falsa/2020/05/06/non-e-vero-che-bill-gates-ha-ammesso-che-i-vaccini-servono-a-sterilizzare-e-ridurre-la-popolazione/,Italian,FALSE,"According to Bill Gates vaccines would not ""sterilize"" the population, but rather they would help reducing the child mortality rate. Some theories (such as the child survival hypothesis) claim that this would eventually lead to a decrease in the world population.",other,['Italy'],youtube.com,https://www.youtube.com/watch?v=AiDRImVVIlY&feature=youtu.be,youtube.com,5/6/20,"['video', 'gates', 'alledgely', 'stating', 'vaccines', 'useful', 'sterilize', 'reduce', 'world', 'population']"
5499,5/7/20,Italy,,,,Italy,Open,"The government and Bill Gates have overshadowed the social profiles of De Donno, the doctor who experiments with plasma treatment in the Mantua hospital. Matteo Salvini: ""Whoever touches Bill Gates' business disappears"".",Social media,https://www.facebook.com/PerSalviniPremier/photos/a.110027290386841/281226789933556/,https://www.open.online/2020/05/07/coronavirus-i-poteri-forti-e-facebook-hanno-oscurato-i-profili-di-de-donno-no-e-non-ce-la-mano-di-bill-gates,Italian,FALSE,Dr. De Donno had suspended his social accounts because he was unable to work in peace. His Facebook page had been suspended by an administrator.,conspiracy theory,['Italy'],facebook.com,https://www.facebook.com/PerSalviniPremier/photos/a.110027290386841/281226789933556/,facebook.com,5/7/20,"['government', 'gates', 'overshadowed', 'social', 'profiles', 'donno', 'doctor', 'experiments', 'plasma', 'treatment', 'mantua', 'hospital', 'matteo', 'salvini', 'touches', 'gates', 'business', 'disappears']"
5363,5/8/20,Brazil,,,,Brazil,Agência Lupa,Bill Gates is funding a vaccine in adhesive patch form. The vaccine contains a microchip that is going to be used to monitor people via 5G network.,Facebook,https://www.facebook.com/photo.php?fbid=3073695679356013&set=a.938992042826398&type=3&theater,https://piaui.folha.uol.com.br/lupa/2020/05/08/bill-gates-vacina-monitorar-pessoas/,Portuguese,FALSE,"The vaccine funded by the Bill and Melina Gates Foundation is not an adhesive patch, but a regular, injectable liquid one. There are no evidence that it contains a microchip that allows you to be tracked down on 5G networks.",conspiracy theory,['Brazil'],facebook.com,https://www.facebook.com/photo.php?fbid=3073695679356013&set=a.938992042826398&type=3&theater,facebook.com,5/8/20,"['gates', 'funding', 'vaccine', 'adhesive', 'patch', 'form', 'vaccine', 'contains', 'microchip', 'going', 'monitor', 'people', 'network']"
6153,5/10/20,United States,,,,United States,FactCheck.org,"Dr. Anthony Fauci is “pushing” remdesivir as a potential COVID-19 treatment drug, because he “invented” it with Bill Gates and they stand to profit from it. ",Facebook posts,https://www.facebook.com/photo.php?fbid=922447538205370&set=a.106797099770422&type=3&theater,https://www.factcheck.org/2020/05/fauci-didnt-invent-wont-profit-from-remdesivir/,English,FALSE,"Remdesivir was invented by the pharmaceutical company Gilead Sciences, which receives any profit from sales of the drug as a treatment for COVID-19.",conspiracy theory,['United States'],facebook.com,https://www.facebook.com/photo.php?fbid=922447538205370&set=a.106797099770422&type=3&theater,facebook.com,5/10/20,"['anthony', 'fauci', 'pushing', 'remdesivir', 'potential', 'covid', 'treatment', 'drug', 'invented', 'gates', 'stand', 'profit']"
6499,5/10/20,United States,,,,United States,PolitiFact,“This is what Bill Gates and George Soros want to do… secretly stick you with a chip while testing you for the coronavirus... the Dems have a bill on the House floor ready to vote on it to require this.”,Facebook posts,https://www.facebook.com/photo.php?fbid=3216228598396846&set=a.236178206401915&type=3&theater,https://www.politifact.com/factchecks/2020/may/28/facebook-posts/theres-no-plot-microchip-people-during-covid-19-te/,English,FALSE,We found no evidence to support this claim.,conspiracy theory,['United States'],facebook.com,https://www.facebook.com/photo.php?fbid=3216228598396846&set=a.236178206401915&type=3&theater,facebook.com,5/10/20,"['gates', 'george', 'soros', 'want', 'secretly', 'stick', 'chip', 'testing', 'coronavirus', 'dems', 'house', 'floor', 'ready', 'vote', 'require']"
5634,5/11/20,Argentina,,,,Argentina,Chequeado,The new coronavirus was created in a Chinese laboratory and Bill Gates financed its origin.,Media,https://drive.google.com/file/d/1mdYBOfJ0ky0uGbnIJo1fqqE0KcCbTNSf/view?usp=sharing,https://chequeado.com/el-explicador/es-falso-que-el-nuevo-coronavirus-fue-creado-en-un-laboratorio-chino-y-que-bill-gates-financio-su-origen/,Spanish,FALSE,"The ""ADN TV"" program, which aired on channel C5N, showed a 2015 report by the Italian channel RAI in which it talks about a coronavirus created in a Chinese laboratory from bats and mice and that it could affect humans. However, the same RAI source details that the coronavirus they talk about in the published article has nothing to do with the cause of the current pandemic (COVID-19). There is also no evidence that the American businessman Bill Gates has financed the origin of the coronavirus through ""Event 201"".",conspiracy theory,['Argentina'],google.com,https://drive.google.com/file/d/1mdYBOfJ0ky0uGbnIJo1fqqE0KcCbTNSf/view?usp=sharing,google.com,5/11/20,"['new', 'coronavirus', 'created', 'chinese', 'laboratory', 'gates', 'financed', 'origin']"
6892,5/11/20,Nigeria,,,,Nigeria,AFP,Multiple posts shared with a picture of a hand-cuffed Bill Gates being led away by FBI agents allege the US billionaire has been arrested for biological terrorism.,FB,https://perma.cc/JUZ5-ZCN8?type=image,https://factcheck.afp.com/image-bill-gates-cuffs-doctored-photo-2014-mobster-arrest,English,FALSE,This is false; the image is doctored and actually shows the 2015 arrest of New York mobster Vincent Asaro. The report was first published by a satirical website but was reproduced elsewhere as real news.,conspiracy theory,['Nigeria'],perma.cc,https://web.facebook.com/betootaadvocate/posts/3174175466010769?_rdc=1&_rdr,facebook.com,5/11/20,"['multiple', 'posts', 'shared', 'picture', 'hand', 'cuffed', 'gates', 'led', 'away', 'fbi', 'agents', 'allege', 'billionaire', 'arrested', 'biological', 'terrorism']"
6376,5/11/20,Poland,,,,Poland,Demagog,Claim that Bill Gates said that coronavirus vaccine will kill or harm 700 000 people.,"Facebook posts, articles",https://www.facebook.com/WolneMedia/posts/2852185044819115,https://demagog.org.pl/analizy_i_raporty/nie-bill-gates-nie-twierdzi-ze-szczepionka-na-koronawirusa-zabije-700-tys-osob/,Polish,FALSE,He did not say those words. He refered hypothetically to the total number of possible side effects of a vaccine applied to the entire world's population.,conspiracy theory,['Poland'],facebook.com,https://www.facebook.com/WolneMedia/posts/2852185044819115,facebook.com,5/11/20,"['claim', 'gates', 'said', 'coronavirus', 'vaccine', 'kill', 'harm', '700', '000', 'people']"
5502,5/11/20,Italy,,,,Italy,Open,Bill Gates patented the Sars-cov2 vaccine in 2014.,Social,Unavaliable,https://www.open.online/2020/05/11/coronavirus-inchiodato-bill-gates-brevetto-del-vaccino-pronto-dal-2014-facciamo-chiarezza,Italian,FALSE,"The patents registered before 2019 are for other coronaviruses, not for Sars-cov2.",conspiracy theory,['Italy'],N/A,Unavaliable,N/A,5/11/20,"['gates', 'patented', 'sars', 'cov2', 'vaccine', '2014']"
6385,5/11/20,Germany,,,,Germany,Correctiv,Bill Gates predicts 700.000 victims because of a COVID-19 vaccine.,Ken.FM,Unavaliable,https://correctiv.org/faktencheck/2020/05/20/nein-bill-gates-hat-nicht-700-000-opfer-durch-eine-corona-impfung-angekuendigt,German,mostly false,"The quote is taken out of context. Bill Gates said that a Covid-19 vaccine should better not have any side effects - because even if only one in ten thousand people are affected, this may lead to 700.000 events worldwide if you vaccinate the whole population.",cures,['Germany'],N/A,Unavaliable,N/A,5/11/20,"['gates', 'predicts', '700', '000', 'victims', 'covid', 'vaccine']"
5699,5/12/20,Italy,,,,Italy,Facta,A YouTube video claiming that in 2014 Bill Gates patenteted the vaccine againt COVID-19.,Youtube,https://www.youtube.com/watch?v=W71QfUiNUbU&feature=youtu.be&t=108,https://facta.news/notizia-falsa/2020/05/13/no-nel-2014-bill-gates-non-ha-brevettato-il-vaccino-contro-la-covid-19/,Italian,FALSE,"The patents mentioned in the video refer to Sars-Cov-1, not Sars-Cov-2 (COVID-19).",cures,['Italy'],youtube.com,https://www.youtube.com/watch?v=W71QfUiNUbU&feature=youtu.be&t=108,youtube.com,5/12/20,"['youtube', 'video', 'claiming', '2014', 'gates', 'patenteted', 'vaccine', 'againt', 'covid']"
6109,5/12/20,United States,,,,United States,PolitiFact,Anthony Fauci was on the Clinton Foundation board for 20 years and “currently serves on Gates Foundation.”,Facebook posts,https://archive.fo/49EOZ,https://www.politifact.com/factchecks/2020/may/19/facebook-posts/no-fauci-wasnt-clinton-foundation-board-two-decade/,English,FALSE,"Anthony Fauci never served on the Clinton Foundation board, according to the nonprofit. He also isn’t a member of the Gates Foundation leadership team.",other,['United States'],archive.fo,https://www.facebook.com/mollyhedie/posts/2955794551183018,facebook.com,5/12/20,"['anthony', 'fauci', 'clinton', 'foundation', 'board', 'years', 'currently', 'serves', 'gates', 'foundation']"
5605,5/13/20,Spain,United States,,,"Spain, United States",Maldita.es,A publication claims that Bill and Melinda Gates didn't vaccine their kids.,Web pages,https://web.archive.org/save/https://www.burbuja.info/inmobiliaria/threads/bill-gates-el-filantropo-de-las-vacunas-no-quiso-vacunar-a-sus-hijos.1127869/,https://maldita.es/malditobulo/2020/05/13/bill-gates-hijos-vacunas/,Spanish,misleading,"The claim is not supported by any evidence, but it did go viral and has appeared on different web pages. Contacted by Maldita.es, the Bill and Melinda Gates Foundation has answered us that ""the statements are false"".",other,"['Spain', 'United States']",archive.org,https://www.burbuja.info/inmobiliaria/threads/bill-gates-el-filantropo-de-las-vacunas-no-quiso-vacunar-a-sus-hijos.1127869/,burbuja.info,5/13/20,"['publication', 'claims', 'melinda', 'gates', 'vaccine', 'kids']"
6149,5/13/20,United States,,,,United States,PolitiFact,"“Due to the large number of people who will refuse the forthcoming COVID-19 vaccine because it will include tracking microchips, the Gates Foundation is now spending billions to ensure that all medical and dental injections and procedures include the chips.”",Facebook posts,https://www.facebook.com/sam.powell.739/posts/3078281155543083,https://www.politifact.com/factchecks/2020/may/20/facebook-posts/no-gates-foundation-isnt-pushing-microchips-all-me/,English,FALSE,"No, the Gates Foundation isn’t pushing microchips with all medical procedures. We found no evidence supporting this claim.",conspiracy theory,['United States'],facebook.com,https://www.facebook.com/sam.powell.739/posts/3078281155543083,facebook.com,5/13/20,"['large', 'number', 'people', 'refuse', 'forthcoming', 'covid', 'vaccine', 'include', 'tracking', 'microchips', 'gates', 'foundation', 'spending', 'billions', 'ensure', 'medical', 'dental', 'injections', 'procedures', 'include', 'chips']"
