,date,country_1,country_2,country_3,country_4,countries,organization,claim,source,source_url,fact_check_url,fact_check_lang,final_rating,explanation,category,countries_list,source_domain,resolved_url,resolved_domain,datetime,claim_p
2252,3/23/2020,Germany,,,,Germany,Correctiv,"You should take high doses of Vitamin D against COVID-19; children don't get sick because they lack the receptors for the virus to bond; the coronavirus is an unnatural mutation; it is not susceptible to temperatures, which is why infections will not sink in summer; the oldest patients will not be treated and left to die; 5G harms the immune system.",WhatsApp,Unavaliable,https://correctiv.org/faktencheck/2020/03/27/vitamin-d-triage-und-5g-erneut-whatsapp-sprachnachricht-mit-falschen-informationen-zum-coronavirus,German,mostly false,There is no evidence that vitamin D can cure or prevent COVID-19; children can get sick but it is unknown why they usually suffer less than adults; experts are convinced the virus originated in nature; the warmer weather will probably make the infection rate sink but not stop the virus; no patients are sorted out only because of their age and electromagnetic fields like 5G can't harm the human body.,conspiracy theory,['Germany'],N/A,Unavaliable,N/A,2020-03-23,"['high', 'doses', 'vitamin', 'covid', 'children', 'sick', 'lack', 'receptors', 'virus', 'bond', 'coronavirus', 'unnatural', 'mutation', 'susceptible', 'temperatures', 'infections', 'sink', 'summer', 'oldest', 'patients', 'treated', 'left', 'die', 'harms', 'immune']"
2783,3/27/2020,Italy,,,,Italy,Open,"According to the University of Turin, taking more Vitamin D will reduce the risk of infection by the coronavirus.",Media,https://torino.repubblica.it/cronaca/2020/03/26/news/coronavirus_studio_dell_universita_di_torino_assumere_piu_vitamina_d_per_ridurre_il_rischio_di_contagio-252369086/,https://www.open.online/2020/03/27/coronavirus-un-nuovo-studio-dimostra-che-la-vitamina-d-riduce-il-contagio-no/,Italian,false,There is not a study from the University of Turin. University professors have written advice for patients with Vitamin D deficiency. Professors don't say it reduces the risk of infection.,cures,['Italy'],repubblica.it,https://torino.repubblica.it/cronaca/2020/03/26/news/coronavirus_studio_dell_universita_di_torino_assumere_piu_vitamina_d_per_ridurre_il_rischio_di_contagio-252369086/,repubblica.it,2020-03-27,"['according', 'university', 'turin', 'taking', 'vitamin', 'reduce', 'risk', 'infection', 'coronavirus']"
2957,3/30/2020,Spain,,,,Spain,Maldita.es,Coronavirus infections are linked to a lack of Vitamin D.,"Whatsapp, Media",Unavaliable,https://maldita.es/malditaciencia/2020/03/30/vitamina-d-audio-coronavirus-infeccion/,Spanish,false,"There is no evidence that Vitamin D reduces the risk of coronavirus infection. Some preliminary studies suggest that it could prevent it, but drawing premature conclusions about studies or publications can be a risk for the general population.",causes,['Spain'],N/A,Unavaliable,N/A,2020-03-30,"['coronavirus', 'infections', 'linked', 'lack', 'vitamin']"
5479,5/10/2020,Argentina,,,,Argentina,Chequeado,Vitamin D helps against the coronavirus.,Social Media,Unavaliable,https://chequeado.com/el-explicador/no-esta-probado-que-la-vitamina-d-ayude-contra-el-coronavirus/,Spanish,misleading,"New research on the coronavirus is constantly appearing, some of it still preliminary, which does not show significant results. Studies on vitamin D indicate that populations that have higher levels of that substance are less impacted by COVID-19. But both variables are observed in paralle, which means it is not enough to affirm that Vitamin D could help with the virus.",cures,['Argentina'],N/A,Unavaliable,N/A,2020-05-10,"['vitamin', 'helps', 'coronavirus']"
6547,5/18/2020,Belgium,,,,Belgium,Factcheck.Vlaanderen,Vitamin D Supplements prevent health problems after coronavirus infection.,Facebook posts,Unavaliable,https://factcheck.vlaanderen/factcheck/kunnen-vitamine-d-supplementen-gezondheidsproblemen-na-een-corona-infectie-voorkomen,Dutch,no evidence,This study was unable to establish a causal relationship between vitamin D and the severity of health problems after a coronavirus infection.,cures,['Belgium'],N/A,Unavaliable,N/A,2020-05-18,"['vitamin', 'supplements', 'prevent', 'health', 'problems', 'coronavirus', 'infection']"
6182,5/19/2020,Myanmar,,,,Myanmar,FactCrescendo,High dosage of Vitamin D is found to be effective as a cure or prevention measure for COVID-19.,Facebook/Twitter,https://archive.vn/frn6N,https://myanmar.factcrescendo.com/fact-check-did-vitamin-d-is-effective-to-cure-or-prevent-covid-19/,Burmese,false,"While there are few ongoing studies about Vitamin D deficiency and its effect on COVID-19 infection, there is no evidence that vitamin D is effective in treating or preventing COVID-19. WHO iterated that there is no single medicine to cure COVID-19.",cures,['Myanmar'],archive.vn,https://www.facebook.com/kelvin.power.1675/posts/246882509921497?_rdc=1&_rdr,facebook.com,2020-05-19,"['high', 'dosage', 'vitamin', 'effective', 'cure', 'prevention', 'measure', 'covid']"
